Step by step,Rating,Image Link,Count Rating,Title,Ingredients,Preparation Time,Finish Time
"Abrikozen en ananassap in een kleine sauspan op een middelhoog vuur verwarmen tot er bubbels ontstaan. Van het vuur halen, apart zetten en af laten koelen.|De oven voorverwarmen op 180°C/gasstand 4 en een bakvorm van 23x12 cm licht invetten.|In een grote kom volkorenmeel, witte bloem, bakpoeder, soda bicarbonaat, suiker, gember, koriander en kaneel mengen.|In een aparte kom ei, plantaardige olie en karnemelk opkloppen en vervolgens mengen met het afgekoelde abrikozenmengsel. In regelmatige porties het mengsel van karnemelk en abrikozen aan het meelmengsel toevoegen en goed mengen.|Beslag in de bakvorm gieten. 50 minuten in de voorverwarmde oven bakken tot een cocktailprikker schoon uit het midden van het brood verwijderd kan worden.|5 minuten laten afkoelen. Vervolgens de zijkanten van het brood met een onscherp mes losmaken en brood uit het bakblik halen. Op een rooster volledig laten afkoelen alvorens te snijden.","<span class=""mediumStar rating35""></span>",http://nlcdn.ar-cdn.com/recipes/xlarge/f11232d9-0115-47c7-9fdc-ef954fe17473.jpg,(7),Gekruid abrikozenbrood,"60 gr gedroogde abrikozen, in stukjes|110 ml ananassap|170 gr volkorenmeel|100 gr witte bloem|2 theelepels bakpoeder|1 theelepel soda bicarbonaat|3 eetlepels donkerbruine muscavado- of basterdsuiker|1 theelepel gemberpoeder|1 theelepel korianderpoeder|1 theelepel kaneelpoeder|1 ei|2 eetlepels koolzaadolie of plantaardige olie|180 ml karnemelk",20,"1,10"
"Meng bloem en zout in een grote kom. Meng water erdoor, beetje bij beetje. Wrijf de reuzel erdoor (of olijfolie) tot het deeg een bal vormt. Leg op een licht bebloemd oppervlak en kneed 10 minuten tot je een glad en soepel deeg hebt.|Verdeel het deeg in 6 delen. Rol elk deel uit tot 2-3 mm dikte.|Verhit een grote zwate pan of een vlakke grilplaat op middelhoog vuur. Bak de broden 2 minuten aan elke kant.|Beleg met je favoriete vleeswaren, kaas of geroosterde groenten, vouw dubbel en serveer.","<span class=""mediumStar rating5""></span>",http://nlcdn.ar-cdn.com/recipes/xlarge/eae0eee4-3d1f-44ab-a9e7-7b64ed836464.jpg,(1),Piadina (Italiaans platbrood),"250 gr bloem|snufje zout|110 ml water|100 gr reuzel, of olijfolie",20,30
"Los het gist op in warm water. Laat staan tot het gaat schuimen, in 10 minuten. Voeg olie, azijn, ei en eiwit toe.|Doe glutenvrij meel met xanthaangom in de kom van een stand mixer. Mix op lage snelheid en voeg geleidelijk de natte ingrediënten toe. Zodra je alles hebt toegevoegd kun je op medium snelheid mixen tot je een glad deegbeslag hebt.|Vet een broodvorm in (inhoud 900 gr / 21x11 cm). Schep het deeg in de vorm en strijk glad met een spatel. Dek af met een theedoek en laat 1 uur rijzen op een warme plek.|Verwarm de oven voor op 190°C.|Bak het brood 45 minuten op het middelste rek in de voorverwarmde oven. Haal het brood uit de vorm, bedek met een theedoek en laat afkoelen.","<span class=""mediumStar rating0""></span>",http://nlcdn.ar-cdn.com/recipes/originalxl/c8a05989-017d-42bb-87ac-6ef0eda2d117.jpg,(0),Glutenvrij witbrood,210 ml warm water|2 theelepels gedroogde gist|3 eetlepels zonnebloemolie (of elke andere plantaardige olie)|1 eetlepel appelcider azijn|1 ei|1 eiwit|280 gr glutenvrij meel|2 theelepels xanthaangom,20,"2,5"
"Los de gist in een paar eetlepels melk op en laat een paar minuten staan totdat het begint te schuimen.|Schil en rasp de aardappels zeer fijn. Leg ze in de kom en laat een paar minuten staan totdat de vloeistof wat aan de bodem gaat zitten. Verwijder de overtollige vloeistof, maar behoud het zetmeelresidu van aardappels.|Combineer de aardappelen met de resterende melk en bloem. Klop de eieren lichtjes los en voeg ze toe aan het mengsel. Roer goed en klop het deeg tot er belletjes vormen. Dek af en laat 30 minuten rijzen.|Roer de rozijnen door het deeg. Vet een broodblik in en vul deze met het deeg. Bedek met een theedoek en laat 20 minuten staan op een warme plaats zodat het weer kan rijzen.|Verwarm de oven voor op 200 C / gasoven stand 6.|Bak het brood 30 minuten zet dan de oven lager tot 180 C / gasoven stand 4. Controleer de gaarheid met een spies.|Laat het brood iets afkoelen voordat je hem uit het blik haalt. Laat volledig afkoelen op een taartrek. Snijd het in dikke sneden en bak deze in plantaardige olie of boter aan beide kanten tot ze goudbruin en knapperig zijn.","<span class=""mediumStar rating45""></span>",http://nlcdn.ar-cdn.com/recipes/xlarge/4ce18dcc-4ed5-4d46-a05a-fff9a078f71e.jpg,(2),Gefrituurd aardappelbrood met rozijnen,125 ml lauwe melk|15 gr gedroogde actieve bakkersgist|1 eetlepel basterdsuiker|1 kg kruimige aardappelen|450 gr witte bloem|2 theelepels zout|3 eieren|200 gr gewassen en gedroogde rozijnen|plantaardige olie of boter voor het bakken,30,2
"De sodafarl over de breedte halveren.|In een koekenpan op matig hoog vuur de olie verhitten en hierin het sodabrood in 2-3 minuten per kant goudbruin en krokant bakken. Heet serveren, eventueel licht met zout bestrooid.","<span class=""mediumStar rating45""></span>",http://nlcdn.ar-cdn.com/recipes/xlarge/79549ee3-ed14-498e-b6da-a4a85add7cba.jpg,(2),Gebakken Ierse sodafarls,"1 kant-en-klare sodafarl|1 eetlepel olijfolie om te bakken|een mespuntje zout, of naar smaak (eventueel)",2,8
"Smelt de boter in het water in de magnetron in intervallen van een paar secondes. Klop dan de eieren erdoor. Schenk in de pan van de broodmachine.|Voeg de rest van de ingrediënten aan de pan toe in de volgorde van de lijst van ingrediënten, eindig met de gist.|Doe de pan in de broodbakmachine en start het programma voor glutenvrij brood.|Haal het deeg uit de machine voor de laatste rijs, en stop het in een ingevette en met bloem bestrooide broodvorm. Laat ongeveer 45 minuten rijzen, tot het in volume is verdubbeld.|Bak het brood op 190°C in ongeveer 35-40 minuten goudbruin. Het brood moet hol klinken als je erop klopt.","<span class=""mediumStar rating0""></span>",http://nlcdn.ar-cdn.com/recipes/xlarge/dd38f257-c527-4a4f-a4f8-1f9a221bc757.jpg,(0),Glutenvrij brood (mijn beste recept),240 ml water|2 eetlepels margarine|2 eieren|1 theelepel zout|3 eetlepels bruine basterdsuiker|1½ theelepel rijstazijn|2-3 eetlepels gemalen lijnzaad|1 eetlepel xanthaangom|60 ml amandelmeel|350 ml tapiocameel|240 ml witte rijstbloem|1 eetlepel bakpoeder|2½ theelepel droge gist (voor de broodbakmachine),10,"1,35"
"Zeef het meel met het zout. Voeg voldoende water toe om een zacht deeg te vormen (niet plakkerig).|Verdeel het deeg in 10-12 porties. Rol elke portie in een plat rondje van 12-15 cm en bestrijk met een beetje olie. Vouw dubbel, bestrijk met ghee en vouw nogmaals dubbel.|Rol het deeg uit en bak 1 paratha per keer in een hete koekenpan of tava, en draai slechts 1 keer om. Na een minuut bakken, bestrijk de randjes dan met wat ghee of olie, waardoor het deeg wat zal rijzen. Draai nogmaals om en bak de andere kant. Als er bruine vlekken ontstaan op beide kanten, is de paratha klaar. Herhaal met de rest van het deeg. Serveer warm met curry, chutney en/of dal.","<span class=""mediumStar rating0""></span>",http://nlcdn.ar-cdn.com/recipes/xlarge/48aad59a-bc3b-4bb0-9f3a-3b28afca00ba.jpg,(0),Paratha (Indiaas plat brood),"375 gr volkorenmeel of chapati bloem (atta)|1 theelepel zout|1-2 eetlepels olie|4 theelepels ghee of olie, om in te bakken",25,55
"Leg een sneetje brood op een plank. Leg een stervormige koeksteker in het midden van de snee brood en druk het erdoorheen. Hou vast terwijl je het brood eromheen weghaalt, zodat de ster niet scheurt. Snij eventueel overtollig brood om de vorm heen weg met een mes. Haal het uitgestoken stukje brood voorzichtig uit de vorm. Herhaal met alle sneetjes brood.|Klop eieren, slagroom, honing, zout, kaneel, sinaasappelrasp en vanille extract samen in een kom.|Smelt de boter in een koekenpan op middelhoog vuur.|Dip beide kanten van de sterren in het eimengsel en leg ze dan in de hete koekenpan. Bak ze aan beide kanten bruin en leg ze op een voorverwarmd bord om ze warm te houden tot alle sterren gebakken zijn. Serveer warm.","<span class=""mediumStar rating45""></span>",http://nlcdn.ar-cdn.com/recipes/originalxl/b488cd8f-be09-4123-bb8b-51c941857295.jpg,(200),Wentelteefjes in de vorm van sterren,8 plakjes witbrood|2 eieren|60 ml slagroom|2 eetlepels honing|1/4 theelepel zout|1/4 theelepel gemalen kaneel|1 eetlepel sinaasappelrasp|1/2 theelepel vanille extract|3 eetlepels (45 gr) boter,10,25
"Los in een kleine maatbeker een halve theelepel suiker in het warme water op, en bestrooi met de gist. Roer tot de gist mengt met het water, en laat staan ​​op een warme plaats tot het schuimt en verdubbeld is in volume, 10 tot 15 minuten. Meng 65 gram suiker, 2 rauwe eieren, zout, het gistmengsel, melk en 300 gram bloem in een grote kom en klop met een elektrische mixer gedurende 3 minuten zodat er gluten ontstaan. Meng de resterende bloem in het beslag en klop tot het deeg glanzend, zacht en elastisch is, ongeveer 5 minuten. Schraap alles naar beneden in de kom, dek af met plastic folie, en koel gedurende 30 minuten.|Plaats stukken boter 2.5 cm van elkaar tussen twee grote stukken bakpapier. Rol de boter uit in een vierkant van ongeveer 30x30 cm, plaats het bakpapier met het vierkante stuk boter op een bakplaat, en zet gedurende 15 minuten in de diepvries.|Plaats het deeg op een met bloem bestoven werkvlak, draai het deeg om zodat het aan alle kanten met bloem bedekt wordt, bestrooi het deeg met bloem. Rol het deeg uit tot een rechthoek van 45x45 cm. Indien nodig, borstel het overtollige bloem van het deeg. Verwijder de bovenste laag bakpapier van het vierkant stuk boter. Plaats het vierkant stuk boter, met het overgebleven bakpapier naar boven, diagonaal op het vierkant stuk deeg, waarbij de hoeken van het deeg uitsteken buiten het stuk boter. Verwijder het overgebleven stuk bakpapier. Vouw de bovenste en onderste punten van het deeg over de boter, zodat ze elkaar in het midden raken, vouw ook de linker- en de rechterpunten over de boter. Kneed de zijkanten en naden van het deeg samen zodat de boter omsloten wordt door het deeg.|Rol de platte deegenvelop gevuld met boter, met de naad naar beneden, op een met bloem bestoven werkblad tot een rechthoek van 30x60 cm en vouw het deeg door de helft (in een vierkant van 30x30 cm), vervolgens nog een keer door de helft zodat je een stuk deeg van 15x30 cm krijgt met vier lagen boter. Koel het deeg ongeveer 5 minuten, rol het deeg vervolgens weer uit tot een 30x60 cm rechthoek en vouw in vieren als voorheen, laat koelen, en herhaal het rollen en vouwen van het deeg nog een keer. Koel het deeg minstens een uur of een hele nacht.|Verwarm de oven voor op 175 graden C. Bekleed 2 bakplaten met bakpapier.|Snijd het deeg in twee stukken (je ziet boterachtige lagen). Rol op een met bloem bestoven werkvlak een stuk deeg uit tot een rechthoek van 75x24cm, snijd de rechthoek in 3 lange repen, 75x8 cm elk. Meng de amandelspijs, 120 gram boter, en 100 gram suiker in een kom, en verspreid de helft van de vulling over het midden van de 3 repen. Vouw de repen over de vulling dicht over het lange eind en kneed de randen dicht, sluit de vulling en maak drie lange touwen. Vlecht de drie touwen samen, en vorm dit tot een ring. Kneed de uiteinden dicht. Herhaal dit bij het tweede stuk deeg en de resterende helft van de vulling, je maakt twee ringvormige gevlochten broden.|Leg de broden op de beklede bakplaten, breng in ringvorm indien nodig. Plaats 3 hardgekookte paaseieren, ingeklemd tussen de vlechten, op de bovenkant van elk gevlochten gebak. Bestrijk het gebak, met eieren en al, met losgeklopt ei, bestrooi met extra witte suiker en geschaafde amandelen.|Bak in de voorverwarmde oven tot ze bruin en knapperig zijn, 40 tot 45 minuten.","<span class=""mediumStar rating4""></span>",http://nlcdn.ar-cdn.com/recipes/xlarge/217510.jpg,(1),Zoet paasbrood met amandelspijs,"1/2 theelepel witte suiker|120 ml warm water (40 tot 45 graden C)|2 pakjes (droge) gist|65 gram witte suiker|2 eieren|1 theelepel zout|180 ml melk|450 gram gezeefde bloem, apart te verwerken|450 gram boter, in stukken|1 pakje (350 gram) amandelspijs|120 gram zachte boter|100 gram witte suiker|6 geverfde hardgekookte paaseieren|1 ei, geklopt|2 eetlepels extra witte suiker om te bestrooien, of naar wens|85 gram geschaafde amandelen, apart te verwerken",1,"1,40"
"Volkorenmeel, witte bloem en zout boven een grote kom zeven en eventueel de zemelen uit de zeef eraan toevoegen. Voeg de gist toe en roer alles door elkaar. Maak in het midden een holte.|Meng het moutextract en de honing met het lauwe water en giet het in het kuiltje in het bloemmengsel. Meng tot een zacht, maar niet kleverig deeg. Voeg dan de rozijnen toe.|Leg het deeg op een lichtbebloemd oppervlak en kneed het circa 10 minuten tot het heel elastisch is. Leg het deeg in een ingevette kom, dek af met keukenfolie en laat het circa 1 uur rijzen op een warme plek, of tot het is verdubbeld in volume. Vet ondertussen een broodvorm van circa 0,5 liter in en bedek de bodem met bakpapier.|Leg het deeg opnieuw op het werkblad en klop er met uw knokkels op. Breng het voorzichtig in vorm en leg het in de bakvorm. Dek af met een vochtige theedoek en laat het 1 uur op een warme plek rijzen tot het in volume verdubbeld is.|Verwarm de oven tegen het eind van de rijstijd voor op 190°C/gasstand 5. Verwijder de theedoek en bak het brood 35-40 minuten tot het hol klinkt wanneer u het uit de vorm haalt en op de onderkant klopt. Leg het op een rooster en laat afkoelen. U kunt het brood tot 4 dagen bewaren.","<span class=""mediumStar rating0""></span>",http://nlcdn.ar-cdn.com/recipes/xlarge/75997ef5-c07b-4578-9321-2d1d9a7663e2.jpg,(0),Moutbrood met sultanarozijnen,"200 g volkorenbloem, bij voorkeur steengemalen|150 g witte bloem|½ tl zout|1 tl instantgist|3 el moutextract|1 el vloeibare honing|200 ml lauw water|85 g sultanarozijnen",40,3
"Roer het kokende water, haver, boter, bruine suiker, zout en melasse door elkaar. Laat afkoelen.|Los 1 theel basterdsuiker op in het warme water. Strooi de gist erdoor en laat het activeren terwijl de haver afkoelt.|Voeg het resterende warme water bij het gekoelde havermengsel. Roer de gist erdoor. Voeg de bloem geleidelijk toe, tot het moeilijk te roeren wordt. Schep de rozijnen door het deeg en meng de kaneel erdoor; roer dit door het deeg. Draai het deeg uit op een licht met bloem bestoven oppervlak en kneed genoeg meel erdoor tot het een zacht maar niet plakkerig deeg is. Dek af. Laat 1 tot 2 uur rijzen op een warme plek, of tot het verdubbeld is in volume.|Verdeel het deeg in 5 gelijke stukken. Vorm er broden van en plaats ze in ingevette broodvormen (23x13cm).|Bak de broden gedurende 20 minuten in een voorverwarmde oven op 190 C / gasstand 5. Verlaag de oven naar 180 C / gasstand 4 en bak nogmaals 20 minuten. Laat de broden vervolgens afkoelen op een rooster.","<span class=""mediumStar rating4""></span>",http://nlcdn.ar-cdn.com/recipes/xlarge/db54dd64-d565-4ac1-a008-4807f1a34dc9.jpg,(9),Rozijnenbrood met kaneel en melasse,450ml kokend water|75g havermoutvlokken|30g boter|3 eetl donkerbruine basterdsuiker|4 theel zout|225g melasse|100ml warm water (45 C)|1 theel basterdsuiker|2 eetl droge gistkorrels|750ml warm water (45 C)|1.75kg bloem|225g gele rozijnen|1 1/2 theel kaneelpoeder,30,"1,10"
"Meng de gist, warm water, suiker, zout, eieren en plantaardige olie in een grote kom. Meng in een andere kom de bloem, kipkruiden, bonenkruid, salie, dille, peper en nootmuskaat. Klop het bloemmengsel door de natte ingrediënten, ongeveer 1 kopje per keer, tot het deeg glad is, voeg meer bloem toe indien nodig.|Leg het deeg op een met bloem bestoven werkblad en kneed tot het deeg elastisch en glad is, ongeveer 8 minuten. Vorm het deeg tot een bal en doe het in een met olie ingevette kom. Draai de deegbal rond in de kom om al het deeg met de olie te bedekken, dek de kom af met een doek en laat het deeg rijzen tot het verdubbeld is in omvang, ongeveer 1 uur.|Vet twee cakevormen in. Maak het deeg plat, kneed het een paar keer om luchtbellen te verwijderen en snijd het deeg in tweeën. Vorm elke helft tot een rol, knijp de naden dicht en doe het deeg in de cakevormen met de naadkanten naar beneden. Bedek de vormen met een doek en laat rijzen tot het deeg verdubbeld is in omvang, 45 minuten tot 1 uur.|Verwarm de oven voor op 190 graden.|Bak de broden tot ze goudbruin zijn, 25 tot 30 minuten; verwijder ze uit de cakevormen en laat afkoelen op roosters.","<span class=""mediumStar rating45""></span>",http://nlcdn.ar-cdn.com/recipes/xlarge/216082.jpg,(15),Hartig brood voor gevogeltevulling,"1 eetlepel gist|480 ml warm water (40 tot 45 graden)|50 gram witte suiker|1 eetlepel zout|2 eieren, losgeklopt|60 ml plantaardige olie|550 gram bloem, of meer indien nodig|2 eetlepels kruidenmix kip|2 eetlepels gedroogd bonenkruid|1 1/2 eetlepel gemalen gedroogde salie|1 eetlepel gedroogde dille (eventueel)|1 theelepel gemalen zwarte peper|1 theelepel gemalen nootmuskaat (eventueel)",20,45
"Meng het water, meel, gluten (indien gebruikt), zout en gist in je broodbakmachine en zet op de deeg cyclus. Het deeg moet mooi wegtrekken van de zijkanten; voeg meer bloem of zo nodig water toe tijdens het mengen, zodat het deeg niet te plakkerig of juist te droog wordt. Aan het eind van de eerste periode van rijzen, haal je het deeg uit de machine, drukt de lucht eruit en leg op een licht met bloem bestrooid oppervlak.|Vet een bakplaat in of bekleed met bakpapier. Rol het deeg uit tot een vierkant van ongeveer 1 cm dik en verdeel het in vier stukken. Roll drie van de stukken op en leg ze naast elkaar met de naad naar beneden op de bakplaat om het hoofd, lichaam en staart te vormen. De uiteinden van de stukken moeten elkaar net raken. (Vergeet niet dat alles groter wordt als het deeg rijst, dus probeer de verhoudingen in gedachten te houden.)|Vet je handen licht in en vorm het deeg alsof je werkt met klei: trek de staart uit en maak een iets gebogen uiteinde, en trek daarna de 'neus' wat uit. Snijd in het uiteinde van de neus om de mond van de krokodil te vormen, houdt de mond open met een stuk ingevet aluminiumfolie.|Van het resterende kwart van het deeg, snij een heel klein stukje af om te gebruiken voor de ogen. Snijd de rest in vier 'stammetjes' voor de benen, druk het einde van elk been wat plat en en steek deze onder het lichaam van de krokodil. Buig de benen iets om terwijl je ze op de bakplaat legt. Maak sneetjes in de uiteindes van de poten om klauwen te maken. Gebruik een schaar om ondiepe sneden over het oppervlak van het deeg te maken (dit is de stekelige huid van de krokodil). Rol het bewaarde deeg uit tot kleine balletjes voor de ogen, en vul elk met een rozijn.|Verwarm een oven voor op 200 graden C / gasstand 6. Klop het ei met 1 eetlepel warm water los in een kleine kom.|Laat de krokodil rijzen op een warme plaats, in ongeveer dertig minuten (druk je vingers  in de zijkanten van het deeg, de afdruk moet blijven staan. Als het deeg terugveert, moet het nog langer rijzen). Bestrijk het deeg met het losgeklopte ei en bak het in de voorverwarmde oven goudbruin zijn, in ongeveer 20 minuten. Verwijder de krokodol van de bakplaat met een spatel en leg het op een rooster. Verwijder het aluminiumfolie zodra het brood afgekoeld is.","<span class=""mediumStar rating45""></span>",http://nlcdn.ar-cdn.com/recipes/xlarge/212892.jpg,(6),Krokodillenbrood,250 ml warm water (45°C)|375g bloem|1 eetlepel tarwegluten (optioneel)|1 1/2 tl zout|2 1/2 theelepel droog bakkersgist|2 rozijnen|1 ei|1 el water,30,50
"Doe warm water, zout, suiker, margarine, 1 ei, bloem en gist in de kom van de broodbakmachine in die volgorde, kies de cyclus voor deeg en start de machine.|Als de deegcuclus klaar is, leg dan het deeg op een bebloemd oppervlak. Verdeel het deeg in 3 delen en rol ze tot lange strengen ter dikte van je duim en ongeveer 30 cm lang. De strengen moeten wat dikker in het midden zijn en dunner aan de uiteinden. Druk de uiteinden samen en vlecht ze.|Vet een bakplaat in of bekleed met bakpapoer en leg de vlecht op de bakplaat. Dek af met een plastic zak zodat het deeg niet uitdroogt en laat rijzen op een warme plek, tot het brood is verdubbeld in volume.|Verwarm de oven voor op 175°C. Klop 1 ei los met 1 eetlepel water en vanille extract, en bestrijk hiermee de Challah. Bestrooi eventueel met decoratie naar keuze.|Bak het brood in de voorverwarmde oven, tot het goudbruin is en het brood hol klinkt als je erop klopt, ongeveer 35-40 minuten.","<span class=""mediumStar rating45""></span>",http://nlcdn.ar-cdn.com/recipes/xlarge/924771a1-ea52-49bc-8e2c-3450d2c3786a.jpg,(28),Challah brood uit de broodbakmachine voor Sjabbat,235 ml warm water (45C)|1 1/2 theelepel zout|2 eetlepels suiker|55 gr boter of margarine|1 ei|410 gr bloem|2 1/4 theelepel droge gist|1 ei|1 eetlepel water|1/8 theelepel vanille extract,15,50
"Doe de eiwitten in een maatbeker. Vul met warm water tot 445 ml.|Meng meel, suiker, gist en zout in de kom van een stand mixer. Mix op de laagste stand. Voeg geleidelijk water-eimengsel toe en mix in ongeveer 3 minuten tot een glad deegbeslag. Dek af met plastic huishoudfolie en laat 2 uur rijzen.|Bestrooi het deeg licht met meel. Weeg 450 gr deeg af en leg op een met meel bestrooid werkoppervlak. Vorm een bal van het deeg. Snij met een nat mes een X in de bovenkant van het brood. Dek het deeg af met een omgekeerde kom en laat 1 uur rijzen. Herhaal met de andere helft van het deeg.|Verwarm de oven 20-30 minuten voor op 230°C met een pizzasteen op het middelste rooster en een braadslee op het onderste rooster.|bestrijk de broden met wat water. Bestrooi de steen met wat maizena en leg het brood er voorzichtig op. Schenk 125 ml water in de braadslee en doe dan direct de ovendeur dicht.|Bak de broden in 45 minuten goudbruin. Haal ze uit de oven en laat afkoelen.","<span class=""mediumStar rating4""></span>",http://nlcdn.ar-cdn.com/recipes/originalxl/cc6ae0f7-f0d6-4ffd-96b0-b167da98bd22.jpg,(1),Rustiek glutenvrij brood,"2 eiwitten op kamertemperatuur|warm water|475 gr glutenvrij meel|1 eetlepel kristalsuiker|½ eetlepel gedroogde gist|1 theelepel zout|maizena, om te bestrooien",20,"4,5"
"Smelt een klontje boter in een steelpan. Voeg een handvol broodblokjes toe. Verdeel ze over de pan en laat ze zoveel mogelijk boter absorberen. Roerbak het brood, totdat het gelijkmatig bruin wordt.|Haal de croutons uit de pan als ze goudbruin zijn. Doe dit ook met de overige broodblokjes en voeg meer boter toe als de pan te droog wordt.","<span class=""mediumStar rating0""></span>",http://nlcdn.ar-cdn.com/recipes/xlarge/62906558-30a6-47a5-a712-853b7f74f973.jpg,(0),Croutons met boter,"45 - 60 gr boter|5-6 sneetjes ciabatta brood, in blokjes",10,25
"Vet een ovenschaal in. Leg de sneetjes brood in twee lagen in de ingevette ovenschaal. Klop de eieren, melk, slagroom, sinaasappelsap, witte suiker, basterdsuiker, kaneel en nootmuskaat in een kom tot een glad mengsel en giet het mengsel over het brood. Druk het brood naar beneden met een grote lepel zodat al het brood wordt doorweekt met het eiermengsel.|Strooi de muesli gelijkmatig over de schotel en besprenkel met ahornsiroop en de gesmolten boter. Dek de schaal af met plastic folie en zet een nacht in de koelkast.|Verwijder de ovenschaal ongeveer 1 uur voor het opdienen uit de koelkast en verwijder de plastic folie. Verwarm de oven voor op 150 graden C.|Bak 30 minuten in de voorverwarmde oven, draai dan de oventemperatuur tot 190 graden C. Bak tot het gerecht bruin is, ongeveer 15 minuten. Serveer warm.","<span class=""mediumStar rating45""></span>",http://nlcdn.ar-cdn.com/recipes/xlarge/77b94ea2-edcf-4b5c-bf9b-444275f81efc.jpg,(12),Challah wentelteefjes met muesli en ahornsiroop,"1 (450 gram) |, in dikke plakken gesneden|4 eieren|450 ml melk|400 ml slagroom|120 ml sinaasappelsap|100 gram witte suiker|100 gram lichtbruine basterdsuiker|snufje kaneelpoeder|snufje gemalen nootmuskaat|60 gram ontbijtmuesli|120 ml ahornsiroop (of honing)|115 gram ongezouten boter, gesmolten",15,1
