Step by step,Rating,Image Link,Count Rating,Title,Ingredients,Preparation Time,Finish Time
"Meng de bloem, gist, 200 gr suiker, zout en wat warme melk. Zet opzij.|Klop in een andere kom de boter, de eieren en de resterende suiker tot een luchtig geheel.|Meng alle resterende deeg-ingedriënten en kneed ze tot een soepel deeg. Bedek het deeg met een theedoek en laat 1 tot 1 1/2 uur rijzen.|Sla het deeg neer en vorm een stol. Leg deze op een bakplaat bedekt met bakpapier en laat vervolgens 20 minuten onbedekt rijzen.|Verwarm intussen de oven voor op 180 ° C / gasoven stand 4. Bak de stol in de voorverwarmde oven gedurende 1 uur of totdat een sateprikker schoon uit het midden komt.|Bestrijk de stol met boter terwijl hij nog warm is. Eenmaal afgekoeld bestrooi je hem royaal met poedersuiker.","<span class=""mediumStar rating35""></span>",http://nlcdn.ar-cdn.com/recipes/xlarge/ddf53aa0-69e9-458b-8558-7e2a8d810fcf.jpg,(11),Duitse stol,"1 kg witte bloem|2 zakjes (7 gr) gedroogde actieve bakkersgist|200 gr basterdsuiker|1 snufje zout|warme melk, zoveel als nodig is|125 gr boter, op kamertemperatuur|6 eieren|100 gr suiker|500 gr gemalen amandelen|250 gr rozijnen|250 gr krenten|500 gr gemengd gedroogd fruit, gesneden|1 onbewerkte citroen, waarvan de schil geraspt wordt|gesmolten boter om het deeg mee te bestrijken|poedersuiker",1,2
"Voeg de gist en 1 theelepel suiker toe aan een kom met 120 ml warm water. Het water mag niet warmer zijn dan 40°C. Laat 5 minuten staan ​​zodat de gist gaat schuimen.|Voeg de melk, plantaardig bakvet, eieren, olie, 375 gr bloem, 50 gr suiker en 1,5 theelepel zout toe. Mix met een elektrische mixer op medium snelheid tot er een mooi glad beslag ontstaat. Kneed de resterende 375 gr bloem er geleidelijk met de hand door. Leg het deeg, als het bij elkaar blijft, op een met bloem bestoven werkblad en kneed  nog even goed door, ongeveer 5 minuten. Het deeg moet nog plakkerig aanvoelen.|Doe wat olie in een grote kom, leg het deeg in de kom en bedek het deeg rondom met een beetje olie. Dek de kom af met een theedoek of plasticfolie en laat op een warme plaats (27 tot 35°C) ong. 1 uur rijzen tot het deeg is verdubbeld in volume. Verwijder de theedoek en duw het deeg met een vuist naar beneden.|Verwarm een ​​oven voor op 175°C.|Verdeel het deeg in porties ter grootte van tennisballen en kneed het deeg tot slangen van ong. 15 cm lang. Rol elk broodje op in een spiraal en zet ze apart.|Meng de baksoda met 950 ml warm water in een kom. De baksoda hoeft niet volledig op te lossen. Doop elk broodje in de baksoda-oplossing voordat je ze op de bakplaat legt. Bestrijk elk broodje met wat gesmolten boter en bestrooi vervolgens met zeezout. Bak in de voorverwarmde oven tot ze bruin zijn, 20 tot 25 minuten. Laat afkoelen op een rooster of op een bruine papieren zak.","<span class=""mediumStar rating45""></span>",http://nlcdn.ar-cdn.com/recipes/xlarge/217284.jpg,(40),Pretzelbroodjes,"20 gr actieve droge gist|1 theelepel suiker|120 ml warm water|475 ml warme melk|75 gr plantaardig bakvet (bijvoorbeeld margarine)|2 eieren|750 gr bloem, apart te verwerken|1 eetlepel plantaardige olie (bijvoorbeeld zonnebloemolie)|50 gr suiker|1,5 theelepel zout|110 gr |950 ml water|55 gr gesmolten boter|1 snufje zeezout","1,30","1,53"
"Meng de gist door het water en laat 5 minuten staan tot de gist is opgelost en het gaat schuimen. Voeg geleidelijk 310 gr bloem toe. Je bewaart de rest voor het kneden. Voeg ook de olie (dit is optioneel) en het zout toe. Kneed tot een wat droog en grof deeg (geen soepele deegbal).|Bestuif het aanrecht met bloem, en kneed het deeg ong. 5-8 minuten met de hand totdat het een soepele deegbal is geworden. Voeg zo nodig meer bloem toe, zodat het deeg niet meer aan je handen of het aanrecht plakt. Maar gebruik niet te veel bloem! Minder bloem is vaak beter.|Leg het deeg in een kom die met een beetje olijfolie is ingesmeerd. Dek de kom af met plasticfolie of een theedoek. Laat het deeg in volume verdubbelen, ong. 2 uur.|Je kunt het deeg na het rijzen in de koelkast zetten. Het deeg blijft een week houdbaar.|Verwarm de oven voor op 230°C. Als je een broodbaksteen hebt, leg je deze op het middelste rek in de oven om voor te verwarmen. Heb je deze niet, schuif dan een bakplaat in het midden van de oven.|Haal het deeg uit de koelkast. Bestuif het aanrecht met bloem. Verdeel het deeg in 8 gelijke stukken en duw de lucht eruit. Strooi ook een beetje bloem over de platgedrukte pitaballetjes. Leg er een theedoek overheen, en laat 10 minuten rusten.|Bestuif het aanrecht met bloem, en rol de deegballetjes één voor één uit tot een cirkel met een doorsnede van 15-20 cm (maak de pita niet te dun). Je kunt een pita in de oven bakken, terwijl je een andere uitrolt.|Leg elke pita ong. 3 minuten in de oven. Leg de pita op de broodbaksteen of bakplaat. Na een minuut of 2 zal de pita opzwellen. De pita is klaar als deze is opgeblazen als een ballon.|Leg de gebakken pita's op een bord bedekt met een schone theedoek. Snij de pita's in partjes.|Serveer de pita's bijvoorbeeld met een lekkere salade en een dip, zoals baba ganoush.","<span class=""mediumStar rating0""></span>",http://nlcdn.ar-cdn.com/recipes/xlarge/e71890ef-78fa-4c7c-a90e-3845cfa8ab3b.jpg,(0),Pita,240 ml warm water|2 theelepels gist (instant)|375 gr bloem|2 theelepels zout|2 eetlepels olijfolie (optioneel),3,"3,20"
"Verwarm de melk in een steelpannetje tot er belletjes zichtbaar zijn, haal dan van het vuur. Doe 5 eetlepels bloem in een grote kom en giet er de melk overheen. Klop tot een gladde massa. Laat vervolgens afkoelen tot het lauw is. Los de gist en suiker in warm water op in een kleine kom. Giet dit bij de gekoelde melk en klop goed. Laat rijzen op een warme plek totdat er belletjes in zitten.|Roer 2 eieren, het eigeel, boter, vanille en citroenschil in het melk/gist mengsel. Meng de bloem erin, ongeveer 125 gram per keer. Goed kloppen na elke toevoeging. Verplaats, zodra er een los deeg ontstaat, het geheel naar een licht met bloem bestoven werkblad en kneed tot een gladde massa, gedurende ongeveer 10 minuten. Kneed de rozijnen er voorzichtig door.|Bedek een grote kom met olie, leg het deeg in de kom en draai het om zodat er een laagje olie overheen komt. Dek af met een vochtige doek en laat het rijzen op een warme plaats tot het verdubbeld is in volume gedurende ongeveer 45 minuten. Het deeg neerslaan en opnieuw laten rijzen tot het verdubbeld is in volume gedurende ongeveer 30 minuten.|Het deeg weer neerslaan en op een licht met bloem bestoven werkblad plaatsen. Verdeel het deeg in drie gelijke stukken en vorm er ronde broden van. Plaats de broden in goed beboterde hoge, ronde vormen. Vul de vormen niet meer dan 1/3. Bedek de vormen met een vochtige doek en laat rijzen tot het in volume verdrievoudigd is, gedurende ongeveer 40 minuten. Verwarm intussen de oven voor op 190 C / gasoven stand 5.|Klop in een kleine kom een ei met 2 eetlepels water. Kwast dit mengsel voorzichtig op de gerezen broden. Bak in de voorverwarmde oven gedurende 10 minuten. Verminder oventemperatuur tot 170 C / gasoven stand 3 en bak gedurende nog eens 30 minuten. Verminder oventemperatuur tot 140 C / gasoven stand 1 en bak nog eens 15 tot 20 minuten, tot ze goudbruin zijn.|Laat de broden 5 tot 10 minuten staan voordat je ze uit de tulbanden haalt. Plaats de broden heel voorzichtig op een met een doek bedekt kussen (nooit een hard oppervlak, aangezien de Babka uit elkaar kan vallen). Draai de broden voorzichtig zodat ze gelijkmatig afkoelen.","<span class=""mediumStar rating45""></span>",http://nlcdn.ar-cdn.com/recipes/xlarge/17976.jpg,(12),Poolse Babka (paasbrood),"250 ml melk|5 eetlepels witte bloem|2 1/2 (7 gr) zakjes gedroogd actief bakkersgist|3 theelepels basterdsuiker|125 ml warm water (45 graden Celsius)|2 eieren|10 eierdooiers|175 gr boter, gesmolten|2 theelepels vanille-extract|2 theelepels rasp van een citroenschil|625 gr witte bloem|125 gr rozijnen|1 ei|2 eetlepels water",30,"1,30"
"Weeg de bloem in een grote kom, voeg aan de ene kant van de bloem de gist toe en aan de andere kant de suiker en zout. Zorg ervoor dat de gist en het zout elkaar niet raken.|Maak een kuiltje in het midden van de bloem en schenk hier de olijfolie in. Voeg het water toe en begin met mixen. Mix tot het een samenhangend deeg is.|Verspreid over je werkblad een beetje olijfolie en leg hier je deeg op. Begin vervolgens met kneden. Kneed tot het een soepel en glad deeg is geworden. Dit duurt in de meeste gevallen 8 tot 10 minuten.|Vet een grote glazen of stenen schaal in met een drupje olijfolie. Plaats hier je deeg in en bedek het met een natte theedoek of plasticfolie. Zorg dat er geen lucht meer bij je deeg kan komen, anders krijg je droge randjes. Laat het deeg rijzen op een warme plek in huis. 60 tot 90 minuten of tot het deeg minimaal is verdubbeld in volume.|Als je deeg verdubbeld is, bestrooi je werkblad met wat bloem. Plaats je deeg op het werkblad en sla het plat. Kneed nog een paar keer door elkaar en vorm het tot de vorm waarin je het zelf wil afbakken. Zie stap 6.|Voor een bakblik: Vet een bakblik in van +/- 900 gram, plaats hierin je deeg.

Voor een rijsmand: Bestrooi je rijsmand met bloem en plaats hierin je deeg.

Voor een schaal: Neem een schaal waarin het deeg tot aan de rand kan rijzen, het deeg moet nog een keer verdubbelen dus hou hier rekening mee. Plaats hierin een droge theedoek en bestrooi deze met bloem, probeer de randen ook goed mee te nemen.

Voor op de bakplaat zelf: Vorm je deeg tot een strakke rond bal. Leg een stuk bakpapier op de bakplaat en bestrooi deze met bloem. Leeg hierop je deeg.|Voor het rijzen neem je een doorzichtige plastic zak die zeer ruim om je bakvorm past en sluit de plastic zak af.  Laat je deeg nog 30 tot 60 minuten op een warme plek rijzen. Het deeg moet wederom verdubbelen.|Ruim voor je brood klaar is met rijzen, verhit je oven voor op 230°C. Plaats een paar minuten voor het bakken een ovenschaal met ruim water onderin de oven. Pas op met het openen van de oven, er zal flink wat stoom uit de oven komen.|Plaats je brood in het midden van de oven. Bak het brood de eerste 20 minuten op 230°C, voer daarna de temperatuur terug naar 210°C. (Op de foto heb ik het brood op een baksteen liggen, dit is optioneel).|Om te testen of je brood klaar is, klop op het brood. Klinkt het hol, dan is je brood klaar.|Mocht je in een bakblik hebben gebakken, haal je brood uit het bakblik, als de bodem nog erg licht van kleur is, plaats dan het brood nog enkele minuten terug in de oven om er iets meer kleur aan te geven. Hou het wel goed in de gaten, dit gaat behoorlijk snel.|Laat je brood afkoelen op een afkoelrooster.","<span class=""mediumStar rating0""></span>",http://nlcdn.ar-cdn.com/recipes/xlarge/38c6174d-4179-456e-aea1-5cd1f13124dc.jpg,(0),Mijn witbrood,500 gr tarwebloem|20 gr verse gist of 10g droge gist|35 ml olijfolie|310 ml handwarm water|3 theelepels kristalsuiker|5 gr zout,10,"3,20"
"Roer de bloem, zout en water samen in een grote kom tot een zacht deeg. Draai het deeg uit op een licht met bloem bestoven oppervlak en kneed even. Verdeel het deeg in stukken ter grootte van een golfval en dek af met een vochtige doek of keukenfolie.|Pak een bal deeg en rol het uit tot het heel dun is - pas op dat het niet scheurt! Bestrooi licht met suiker. Vouw het in een klein vierkant en rol het opnieuw heel dun uit.|Verhit een licht ingevette bakpan over matig vuur. Plaats het uitgerolde deeg in de pan en bak 30 seconden tot 1 minuut per kant tot het goudkleurig is. Dien onmiddelijk op. Herhaal met alle deegballen.","<span class=""mediumStar rating45""></span>",http://nlcdn.ar-cdn.com/recipes/xlarge/2c1cfced-becd-4f0f-a7cd-902dbee1fb2c.jpg,(78),Indiase zoete roti,250g bloem|¼ theel zout|150ml water|50g suiker|1 eetl koolzaadolie,20,40
"Gist met het warme water in een grote kom laten staan tot het mengsel schuimig is.|Hete melk, suiker, boter, zout en 125 ml in een middelgrote kom tot 45°C laten afkoelen.|In een beker 5 eieren licht opkloppen en door de afgekoelde melkmix roeren. Melk- en eiermix aan het gistmengsel toevoegen. Dit samen met 250 gr bloem tot een glad deeg mengen. Resterende bloem geleidelijk toevoegen tot een stijf deeg is ontstaan. Op een bebloemde ondergrond 10 minuten kneden (of 5 minuten met de deeghaken van een mixer). Het deeg in een grote, licht ingevette glazen of plastic bak leggen en het deeg draaien zodat het aan alle kanten ingevet is. Afdekken en ong. 1 uur op een warme, donkere plek tot verdubbeld volume laten rijzen.|Het deeg neerslaan, afdekken en nogmaals tot verdubbeld volume laten rijzen, in dit geval ong. 30 minuten.|Deeg weer neerslaan en in 3 porties verdelen. Van elk deel een rol van 50 cm maken en deze op een grote ingevette bakplaat vlechten. Afdekken en tot verdubbeld volume laten rijzen.|Resterende ei licht opkloppen en daarmee de bovenkant van de broodvlecht insmeren. Sesamzaad erover sprenkelen. 55 minuten in de voorverwarmde oven op 180°C/gasstand 4 lichtbruin bakken. De baktijd iets inkorten als u met het deeg 2 broden van kleiner formaat wilt bereiden.","<span class=""mediumStar rating45""></span>",http://nlcdn.ar-cdn.com/recipes/xlarge/8b9d698d-8df7-49b2-bbf0-5515bef78e67.jpg,(159),Brioche Vlecht,"2 zakjes droge actieve gist|100 ml warm water (45°C)|450 ml halfvolle melk, verhit|100 gr suiker|100 gr boter|2 theelepels zout|125 ml water|5 eieren|1,3 kg bloem|1 ei|2 eetlepels sesamzaad",2,"2,55"
"Verwarm de oven voor op 200°C.|Haal de rozemarijn van het steeltje.|Meng in een grote kom de rozemarijn met het volkorenmeel en de gezeefde bloem, baksoda en zout.|Voeg karnemelk en honing toe. Meng tot je een zacht deeg krijgt.|Leg op een bebloemd oppervlak en kneed tot een soepel deeg.|Vorm een rond brood van het deeg en snij twee kruizen (een ster) in de bovenkant, zodat er 8 driehoeken ontstaan.|Bak 40 minuten op een licht met bloem bestrooide bakplaat in de voorverwarmde oven. Als het brood klaar is, klinkt het hol als je er op klopt.|Laat 10 minuten rusten voor je het brood aansnijdt. Als je een zachtere korst wilt, kun je het brood afdekken met een schone vochtige theedoek.","<span class=""mediumStar rating45""></span>",http://nlcdn.ar-cdn.com/recipes/originalxl/d31e88a0-d876-4f25-8c96-9b1566a3f945.jpg,(31),Sodabrood met honing en rozemarijn,200 gr volkorenmeel|275 gr bloem|300 ml karnemelk|1 afgestreken theelepel baksoda|snufje zout|6 eetlepels honing van goede kwaliteit|1 takje verse rozemarijn,5,45
"Warm een kommetje op door het met heet water om te spoelen. Giet het warme water erin en strooi er 1 zakje gist op. Laat staan totdat gist is opgelost. Roer er 60 gram van de bloem door, dek af met plasticfolie, en laat 30 minuten staan, tot het verdubbeld is. Strooi de resterende gist in warme melk. Laat staan tot het opgelost is. Mix de suiker, eieren, eierdooiers en vanille door elkaar. Roer het melk-gistmengsel hier doorheen. Voeg water-gistmengsel toe en roer tot het goed vermengd is.|Meng de resterende boter en bloem tot een kruimelig deeg. Giet langzaam het eimengsel erbij en mix op hoge snelheid 3 tot 4 minuten, tot het deeg elastisch lijkt en zich lange draden vormen. Klop het fruit en rasp erdoor. Leg het deeg in een geoliede kom, dek af met plastic folie en laat op een warme plek rijzen tot het in volume is verdubbeld, in ongeveer 2 tot 3 uur.|Vouw mallen naar beneden tot een manchetvorm van 7cm. Bestrijk van binnen en van buiten met gesmolten boter. Leg het deeg op een licht met bloem bestoven werkvlak en kneed het een paar keer door om de lucht eruit te laten. Verdeel het deeg in 3 stukken. Rol elk stuk tot een bal en leg deze in de voorbereide vormen. Zet ze op een bakplaat ongeveer 10cm uit elkaar en dek losjes af met plasticfolie. Laat het op een warme plaats rijzen tot het in volume is verdubbeld, in ongeveer 2 uur.|Verwarm de oven voor op 200 graden C / gasstand 6. Snij een X in de bovenkant van elk brood met een schaar gedipt in olie. Meng eidooier met room. Bestrijk de bovenkanten van de broden licht met het eimengsel.|Plaats de bakplaat in de onderste 1/3 van de oven. Zet de temperatuur na 10 minuten, lager tot 190 graden C / gasstand 5. Bak nog eens 30 minuten, als de bovenkanten te bruin worden, dek dan af met folie. Broden zijn klaar als een prikker in het midden gestoken er schoon uitkomt. Laat afkoelen op rooster.","<span class=""mediumStar rating45""></span>",http://nlcdn.ar-cdn.com/recipes/xlarge/fe7c5efa-86a7-4579-8be7-85e878becce8.jpg,(23),Panettone broden,"5 eetlepels warm water (45 C)|2 (7g) zakjes gedroogde gist|500g bloem|125ml warme melk|125g suiker|4 eieren|2 eidooiers|1 theelepel vanille-extract|12 eetlepels ongezouten boter|325g gemengde geglaceerde vruchtjes|2 1/2 theelepel geraspte citroenschil|2 eetlepels sinaasappelrasp|2 eetlepels boter, gesmolten|1 eidooier|1 eetlepel room",45,"1,25"
"Meng de appels met suiker, rum en cognac. Laat gedurende een nacht wellen.|Combineer alle overige ingrediënten, behalve de appelsap in een kom. Voeg het appel-rum mengsel toe en roer goed om het volledig op te nemen. Roer de appelsap erdoor.|Verwarm de oven voor op 180 ° C / gasoven stand 4. Bedek twee bakplaten met bakpapier.|Giet het beslag in de bakvormen en bak gedurende 60 minuten. Verwijder het appelbrood uit de blikken en bak nog eens 10-20 minuten of totdat het brood goudbruin van kleur is geworden.","<span class=""mediumStar rating45""></span>",http://nlcdn.ar-cdn.com/recipes/xlarge/1f55ee58-0ae9-4201-a71b-4513aad6b9bc.jpg,(9),Gekruid appelbrood,"900 gr appels, in blokjes|200 gr basterdsuiker|2 eetlepels rum|1 eetlepel cognac|200 gr rozijnen|200 gr hele hazelnoten, walnoten of amandelen|100 gr pruimen|500 gr speltmeel (of tarwemeel)|2 theelepels bakpoeder|1 eetlepel ongezoete cacaopoeder|1 snufje gemalen kruidnagel|1/2 theelepel zout|1 eetlepel kaneelpoeder|1 scheutje appelsap",10,"1,20"
"Kook het water, suiker, olie, zout, sinaasappelrasp, karwij en venkelzaden in een pan gedurende 3 min. Laat afkoelen tot het lauwwarm is.|Meng de helft van de gewone bloem met gist in een grote kom. Roer het gekoelde sinaasappelraspmengsel erdoor. Mix dit gedurende 2 min met een electrische mixer op de middelmatige stand. Meng de eieren erdoor.|Voeg 1/2 van resterende gewone bloem toe en mix 1 min op middelmatige stand. Voeg de roggebloem toe en net genoeg van de gewone bloem tot het een stijf deeg is.|Draai het deeg uit op een licht met bloem bestoven oppervlak. Kneed in 8 tot 10 minuten tot een glad deeg. Vorm een bal van het deeg, plaats dit in licht ingeoliede kom en wentel het een paar keer rond in de kom.|Dek het deeg af met vochtige doek en plaats het op warme plek. Laat 11/2 uur rijzen tot het verdubbeld is.|Sla het deeg neer en verdeel het in twee stukken. Vorm er twee ballen van en laat het vervolgens 10 minuten rusten.|Vorm twee broden van de ballen en plaats ze in niet-ingevette broodvormen (23x13cm). Bestrijk ze met olie en laat ze 1 uur rijzen tot ze in volume verdubbeld zijn.|Bak ze in 30-35 minuten gaar in een oven op 200C / gasstand 6.","<span class=""mediumStar rating45""></span>",http://nlcdn.ar-cdn.com/recipes/xlarge/63d42a9d-13af-4392-9d95-c63bb48889ff.jpg,(17),Zweeds roggebrood,450ml water|100g donkerbruine basterdsuiker|2 eetl plantaardige olie|2 theel zout|2 theel sinaasappelrasp|1 1/2 theel karwijzaad|1 1/2 theel venkelzaad|675g bloem|2 (7g) zakjes droge gist|2 eieren op kamertemperatuur|200g roggebloem,45,"1,20"
"Verwarm de oven voor op 150°C. Bedek een bakplaat met bakpapier.|Doe de eiwitten in een schone kom en voeg bakpoeder toe. Klop de eiwitten helemaal stijf (stijve pieken) met een elektrische mixer.|Doe de roomkaas in een andere kom en voeg de eidooiers, zout en Italiaanse kruiden erdoor, mix met een garde tot het goed gemengd is.|Schep het eidooiermengsel voorzichtig met een spatel door het stijfgeslagen eiwit tot het net gemengd is en geel van kleur.|Schep het mengsel in ongeveer 6 rondjes van 10 cm doorsnee op de bakplaat, strijk uitstekende pieken glad met de achterkant van een lepel.|Bak 25 minuten in de voorverwarmde oven tot de broodjes licht goudbruin zijn.","<span class=""mediumStar rating4""></span>",http://nlcdn.ar-cdn.com/recipes/xlarge/2149fb7c-1c6b-4ead-9e4b-2b99605af285.jpg,(1),Cloud bread met Italiaanse kruiden,"2 eieren, gesplitst, op kamertemperatuur|1/4 theelepel bakpoeder|2 eetlepels roomkaas, op kamertemperatuur|snufje zout|2 theelepels Italiaanse kruiden (oregano, basilicum...)",10,35
"Verwarm de oven voor op 150°C. Bedek een bakplaat met bakpapier.|Doe de eiwitten in een schone kom en voeg bakpoeder toe. Klop de eiwitten helemaal stijf (stijve pieken) met een elektrische mixer.|Doe de roomkaas in een andere kom en voeg de eidooiers en snufje zout erdoor, mix met een garde tot het goed gemengd is.|Schep het eidooiermengsel voorzichtig met een spatel door het stijfgeslagen eiwit tot het net gemengd is en geel van kleur.|Schep het mengsel in ongeveer 6 rondjes van 10 cm doorsnee op de bakplaat, strijk uitstekende pieken glad met de achterkant van een lepel.|Bak 20-25 minuten in de voorverwarmde oven tot de broodjes licht goudbruin zijn (niet te donker, want ze moeten nog even in de oven).|Laat het cloud bread 10 minuten afkoelen op de bakplaat. Zet ondertussen de oven hoger op 190°C.|Meng tomatenpuree, olie, water en kruiden naar smaak door elkaar tot je een smeerbare saus hebt.|Besmeer de broodjes met de tomatensaus en beleg met tomaat en vervolgens met geraspte kaas. Bestrooi eventueel nog met wat Italiaanse kruiden.|Schuif de bakplaat weer in de oven en bak de pizza's in 5-8 minuten af. Eet smakelijk!","<span class=""mediumStar rating5""></span>",http://nlcdn.ar-cdn.com/recipes/xlarge/cb4cd748-a296-490d-ac98-d86d4709efb7.jpg,(1),Cloud bread pizza,"2 eieren, gesplitst, op kamertemperatuur|1/4 theelepel bakpoeder|2 eetlepels roomkaas, op kamertemperatuur|snufje zout|2 flinke eetlepels tomatenpuree|scheutje olijfolie|scheutje water|zout, peper, Italiaanse kruiden, naar smaak|1 tomaat, in dunne plakjes|geraspte kaas",10,35
"Los de gist en 1 theelepel rietsuiker op in 120 ml warm water. Laat 10 minuten staan zodat het gaat schuimen.|Je kunt het deeg met de hand kneden of in een keukenmachine mengen (met de hand geeft een iets beter eindresultaat, vind ik). Meng de bloem, 4 theelepels suiker en het zout. Voeg het gistmengsel toe, en meng. Meng geleidelijk de olie en het lauwwarme water erdoor. Kneed tot een samenhangende deegbal. Gebruik iets meer water toe indien het deeg te droog is.|Bestuif een werkblad met bloem, en kneed het deeg 2 minuten met de hand tot het soepel en elastisch aanvoelt. Leg een theedoek over het deeg, en laat 20 minuten rijzen.|Snij het deeg in 8 gelijke stukken. Rol elke deegbal tot een sliert van ong. 20 cm lang. Knijp uiteinden samen, zodat een ring ontstaat. Dek af met een theedoek en laat de bagels 30 minuten rijzen.|Zet ondertussen een pan met ruim water op, en los hierin 1 theelepel honing en 1 theelepel zout op. Leg ook meerdere vellen keukenpapier klaar op het aanrecht, zodat de gekookte bagels straks kunnen uitdruipen. Verwarm de oven voor op 200°C.|Laat voorzichtig 3 bagels per keer in het kokende water glijden. Laat 30 seconden koken, draai de bagels om, laat weer 30 seconden koken, en haal de bagels dan onmiddellijk uit het water met een schuimspaan. Laat vervolgens uitdruipen op keukenpapier. Doe dit voor alle bagels.|Versieren is optioneel, want neutraal zijn ze ook lekker. Indien een andere korst gewenst is, zet dan 2 diepe borden klaar. Vul 1 bijvoorbeeld met maanzaad en 1 met sesamzaad. Doop de bovenkant van de bagels in de zaadjes.|Vet een bakplaat in met olie of boter. Verdeel de bagels over de bakplaat. Bak ze in 20 minuten in de voorverwarmde oven goudbruin.","<span class=""mediumStar rating0""></span>",http://nlcdn.ar-cdn.com/recipes/xlarge/3e0ea756-2a03-4a50-af77-8b3078abe537.jpg,(0),Bagels maken,"1 eetlepel gedroogde actieve bakkersgist (is ongeveer 1 zakje gist)|1 theelepel rietsuiker|120 ml warm water|400 gr bloem|4 theelepels rietsuiker|1,5 theelepel zout|100 ml lauwwarm water, of iets meer|1 theelepel zonnebloemolie|ruim water|1 theelepel honing|1 theelepel zout|2 eetlepels maanzaadjes (indien gewenst voor de korst)|2 eetlepels sesamzaadjes (indien gewenst voor de korst)",10,"1,40"
