Step by step,Rating,Image Link,Count Rating,Title,Ingredients,Preparation Time,Finish Time
"De ingrediënten aan de broodmachine toevoegen.|Kies het deegmenu en druk op Start. Meng het brood 3-5 minuten tot de bananen gepureerd zijn en de ingrediënten goed gemengd. Indien nodig met een rubberen spatel het deeg van het bakblik verwijderen. Na 3-5 minuten op Stop drukken. Niet verder mengen.|De bovenkant van het deeg met een rubberen spatel egaliseren.|Bakmenu kiezen en op Start drukken. De baktijd kan per machine verschillen, maar moet ong. 50 minuten bedragen. Het brood is gaar als een cocktailprikker schoon uit het midden van het brood komt. Als er nog deeg aan de cocktailprikker zit de machine weer in bakstand zetten en 10-15 minuten verder bakken. Blijven controleren tot het brood gaar is.|Het bakblik uit de machine halen. Het brood nog 10 minuten in het blik laten zitten, dan eruit halen en op een rooster volledig laten afkoelen.","<span class=""mediumStar rating45""></span>",http://nlcdn.ar-cdn.com/recipes/xlarge/e1eca0f2-1e6a-4e42-adc5-87186edd8d42.jpg,(457),Bananenbrood uit de broodbakmachine,"260 gr bloem|1 theelepel bakpoeder|1/2 theelepel soda bicarbonaat|150 gr suiker|3 eetlepels plantaardige olie|2 eieren|2 bananen, gepeld en in lengterichting gehalveerd",5,55
"Verwarm de oven voor op ongeveer 160-170 C /gasovenstand 3 tot 4 en bekleed een grote broodvorm/cakevorm met bakpapier.|Mix in een keukenmachine de boter, suiker en ei tot een glad geheel. Voeg de bananen toe (breek ze eerst in stukjes indien nodig) en pureer weer tot het glad is. Voeg de cacao en de gemalen hazelnoten toe (voeg geen hele noten toe voordat het gemixt is).|Mix het snel door en meng dan (door een zeef) de bakpoeder en baksoda door de bloem en voeg dat bij, dan de melk en mix nog even door tot het goed gemengd is.|Als je chocoladestukjes gaat toevoegen, voeg ze dan toe nadat je het beslag uit de keukenmachine hebt gehaald. Meng dat laatste er dan met de hand door.|Schenk het beslag in de vorm. Als je wilt kun je nu nog wat hele hazelnoten of chocoladestukjes in het beslag drukken.|Bak dit ongeveer een uur, tot een prikker in de cake gestoken er schoon uitkomt.|Serveer koud (in plakjes) of warm met ijs!!! Warm serveren is heerlijk, want dan blijft de chocola nog even zacht!","<span class=""mediumStar rating45""></span>",http://nlcdn.ar-cdn.com/recipes/xlarge/3187da3e-786e-4c9c-854f-7253c775b8a1.jpg,(16),Bananenbrood met chocola en hazelnoten,2 eetlepels ongezouten boter|150g basterdsuiker|1 ei|3 grote rijpe bananen|8 eetlepels cacaopoeder|60g gemalen geroosterde hazelnoten|175g bloem|1 theelepel bakpoeder|1 theelepel baksoda|2 eetlepels melk|*Optioneel - goede kwaliteit pure chocolade in kleine stukjes,10,"1,10"
"Doe water, meel, melkpoeder, suiker, zout, boter, tomaten en gist in de broodbakmachine in de volgorde die de fabrikant aangeeft. Zet op de deegstand en start de machine|Als de broodbakmachine klaar is, haal je het deeg eruit en kneed nog eens 1 minuut met de hand. Leg in een met olie ingevette kom en draai het deeg om zodat het een laagje olie heeft. Dek af met een vochtige theedoek en laat 15 minuten rijzen op een warme plek.|Bestuif een bakplaat met maismeel. Rol het deeg uit zo groot als de bakplaat. Maak kuiltjes in het deeg met je vingers. Bestrijk de bovenkant met olie en dek af met een vochtige doek. Laat 30 minuten rijzen.|Bestrooi met Parmezaanse kaas, rozemarijn, knoflookzout en mozzarella.|Bak het brood in de oven 15 minuten op 200 graden C, tot het mooi bruin is. Laat iets afkoelen en snijd in vierkantjes.","<span class=""mediumStar rating45""></span>",http://nlcdn.ar-cdn.com/recipes/xlarge/aa25650f-e07b-4829-822d-8debc863c743.jpg,(74),Focaccia met zongedroogde tomaten en mozzarella,250 ml water|400 gr bloem|1 eetlepel melkpoeder|3 1/2 eetlepels suiker|1 theelepel zout|3 eetlepels boter|2 theelepels gedroogde gist|25 gr fijngesneden zongedroogde tomaatjes|2 eetlepels olijfolie|2 eetlepels geraspte Parmezaanse kaas|2 theelepels gedroogde rozemarijn|1 theelepel knoflookzout|120 gr geraspte mozarella,30,"1,30"
"In een kleine kom de zongedroogde tomaten onder kokend water zetten. 10 minuten laten weken, dan afgieten en tot kamertemperatuur laten afkoelen. Met een schaar in kleine stukjes knippen.|De ingrediënten volgens de gebruiksaanwijzing in de broodmachine doen. Selecteer het basismenu of het menu voor wit brood en druk op Start.","<span class=""mediumStar rating35""></span>",http://nlcdn.ar-cdn.com/recipes/xlarge/7e9e2f32-d5f8-4bbc-b3bc-1473fe7720b4.jpg,(28),Basilicumbrood met zongedroogde tomaat,"2 1/4 theelepel droog bakkersgist|400 gr bloem|3 eetlepels tarwevlokken|5 eetlepels quinoa|3 eetlepels droge melkpoeder|1 eetlepel gedroogde basilicum|25 gr zongedroogde tomaat, in stukjes|1 theelepel zout|280 ml water|225 ml kokend water",10,"3,10"
"Het gist over een kommetje met 125 ml warm water strooien (> 40°C). 5 minuten laten staan tot het gist zacht en schuimig wordt.|Een grote koekenpan op een middelhoog vuur met olijfolie verhitten en daarin de ui 3 minuten al roerend zacht bakken. De ui van het vuur halen en apart zetten.|In een grote kom bloem, zout, suiker, dille, knoflookkorrels, olijven en gebakken ui goed mengen. Gistmengsel en resterende water toevoegen. Goed mengen tot de ingrediënten gepakt hebben en een klef deeg is gevormd. Het deeg op een licht bebloemd oppervlak leggen en in ong. 8 minuten glad en elastisch kneden.|Een grote kom licht met olie invetten en daarin het deeg een olielaagje geven. Met een lichte doek afdekken en op een warme plek (27-35°C) in ong. 1 uur tot een verdubbeld volume laten rijzen.|2 bakplaten licht invetten. Het gerezen deeg neerslaan en op een licht bebloemd oppervlak leggen. Met een vork en zonder te trekken het deeg in 2 gelijke delen verdelen en dit in 2 ronde broden vormen. De broden op de ingevette bakplaten leggen, afdekken met een vochtige doek en in ong. 40 minuten tot verdubbeld volume laten rijzen.|De oven voorverwarmen op 230°C/gasstand 8.|De broden in de voorverwarmde oven ong. 40 bakken tot de bovenkant goudbruin is en de bodem hol klinkt als u er tegenaan tikt. Even laten afkoelen alvorens te snijden.","<span class=""mediumStar rating45""></span>",http://nlcdn.ar-cdn.com/recipes/xlarge/931adc38-ffca-4af1-9dba-8557a7fd47e4.jpg,(11),Grieks olijven-uienbrood,"2 zakjes (7 gr) snel gist|125 ml warm water|2 eetlepels extra virgin olijfolie|2 grote rode uien, in blokjes|1 kg bloem|1 1/2 theelepel zout|1/2 theelepel ruwe basterdsuiker|4 eetlepels verse dille, fijngesneden|1/4 theelepel knoflookkorrels (eventueel)|275 gr ontpitte kalamata olijven, fijngesneden|425 ml warm water",30,"1,15"
"Meng de bloem, maismeel, suiker, bakpoeder, zout, ei, melk en plantaardige olie in een magnetronbestendige glazen of aardewerken schaal.|Verhit ongeveer 3 minuten in de magnetron op hoog vermogen, totdat een prikker in het midden gestoken er schoon uitkomt; draai de schaal halverwege de kooktijd als de magnetron niet beschikt over een roterende plaat.","<span class=""mediumStar rating45""></span>",http://nlcdn.ar-cdn.com/recipes/xlarge/213605.jpg,(100),5 minuten maïsbrood uit de magnetron,60 gr bloem|60g polenta (maïsmeel)|2 el basterdsuiker|2 tl bakpoeder|1/4 tl zout|1 ei|120ml melk|2 el plantaardige olie,2,5
"Doe het water, de boter, suiker, zout, tarwemeel, glutenmeel en gist in de broodbakmachine in de volgorde zoals de gebruiksaanwijzing aangeeft.|Zet de machine op de deeg stand.|Haal het gerezen deeg uit de machine en druk enigszins de lucht eruit. Vorm er een mooi brood van en leg deze op een bakplaat bestrooid met wat bloem. Laat het brood afgedekt met een vochtige doek nog minstens een half uur rijzen. Verwarm tijdens het rijzen de oven voor tot 220 graden.|Besprenkel het gerezen deeg met water en bestrooi met bloem (voor een knapperige korst). Bak het brood in 20 minuten lichtbruin. Het brood moet hol klinken als je erop klopt.","<span class=""mediumStar rating4""></span>",http://nlcdn.ar-cdn.com/recipes/xlarge/4a9111c7-5449-4bee-9687-78f856256c60.jpg,(1),Witbrood in de oven gebakken,"335 gr tarwemeel|15 gr glutenmeel|220 ml water|40 gr boter, in blokjes|5 gr zout|2 theelepels suiker|1 zakje (7gr) gist","1,30","2,20"
"Verwarm de oven voor op 220 graden. Bekleed een bakplaat met bakpapier.|Doe in een grote kom de broodmix, zout en bakpoeder en meng alles goed. Voeg de boter, karnemelk en poedersuiker toe en kneed tot een deeg; voeg vervolgens voorzichtig de ui en kaas toe. Verdeel het deeg door de helft en vorm elke helft tot een bal. Leg de broden op de bakplaat en maak ze voorzichtig plat tot ongeveer 5 centimeter dik. Bestrooi elk brood met wat meel.|Bak in de voorverwarmde oven tot ze bruin zijn, ongeveer 30 minuten. Laat de broden een aantal minuten afkoelen op een rooster en serveer warm.","<span class=""mediumStar rating45""></span>",http://nlcdn.ar-cdn.com/recipes/xlarge/a1cda886-0c8c-488e-aa55-060174376c5b.jpg,(137),Iers sodabrood met kaas en ui,"550 gram broodmix, plus meer voor bestrooien|1 1/2 theelepel zout|1 eetlepel bakpoeder|85 gram zachte boter|300 ml karnemelk|2 eetlepels poedersuiker|120 gram fijngesnipperde ui|90 gram geraspte (jong) belegen kaas",15,45
"Laat de gist oplossen in het lauwwarme water, samen met de suiker. Laat 10 minuten staan tot het gaat schuimen.|Meng bloem, gistmengsel, 1 ei en boter samen in een kom totdat er geen droge stukjes meer tussen zitten en laat 10 minuten staan.|Voeg zout toe en kneed in 5 minuten tot een soepel deeg. Vet een kom in met een beetje olie, leg de deegbal erin, en rol de deegbal even door de olie. Dek de kom af met een vochtige theedoek. Laat de deegbal ong. 1 uur in de kom rijzen.|Bestuif een werkblad met wat bloem. Verdeel het deeg in 6 stukken. Rol elk stuk deeg tot een bal, bedek ze met een theedoek en laat ze 15 minuten rijzen.|Je kunt de kaiserbroodjes nu induwen met een speciale stempel voor kaiserbroodjes. Heb je dit plastic apparaatje niet, dan kun je ook elke bal uitrollen tot een lange sliert. Leg in het midden van de sliert een losse knoop en wikkel de uiteinden steeds door de knoop heen. Zie de tip hieronder voor meer informatie.|Leg de broodjes op een bakplaat en laat ze weer rijzen, ong. 30 minuten, tot ze in volume zijn verdubbeld.|Verwarm ondertussen de oven voor op 200-220°C.|Klop 1 ei los en bestrijk de broodjes ermee. Bak de broodjes in ong. 15 minuten goudbruin. Laat ze op een rooster afkoelen.","<span class=""mediumStar rating3""></span>",,(2),Kaiserbroodjes,"230 ml lauwwarm water|4 gr gist|8 gr suiker|450 gr bloem|2 eieren, apart te verwerken|25 gr zachte boter|6 gr zout",20,"1,20"
"Verwarm in een kleine sauspan de melk tot het borrelt. Van het vuur nemen en suiker, zout en boter toevoegen. Laat tot lauw afkoelen. Terwijl het melkmengsel afkoelt het gist in warm water oplossen en laten staan tot het een romige massa is.|De afgekoelde melk en het gistmengsel in een grote kom samenvoegen. 270 gr bloem erdoor mengen, vervolgens beetje bij beetje de resterende bloem totdat een gemiddeld stijf deeg is ontstaan.|Op een licht bebloemd oppervlak het deeg 8-10 minuten kneden, of tot het soepel en elastisch is. Het deeg in een kom leggen die licht met olie is ingevet. Draai het deeg door de kom zodat het een laagje olie krijgt.|De kom afdekken met een schone, vochtige theedoek. Gedurende ong. 1 1/4 uur op een warme plek laten rijzen, of tot het deeg in omvang verdubbeld is.|2 broodvormen van 23x12 cm licht invetten.|Het deeg met de vuist inslaan en over een licht bebloemd oppervlak verdelen. In 2 ballen verdelen, afdekken en weer 10 minuten laten rijzen. Vervolgens het deeg in langwerpige vorm kneden en in de bakvormen leggen. Opnieuw laten rijzen tot de omvang verdubbeld is (ong. 1 uur).|De oven voorverwarmen op 190°C/gasstand 5.|Gedurende 35 minuten in de voorverwarmde oven bakken, of tot de bovenkant goudbruin is en het brood een holle klank heeft als u tegen de onderkant van de bakvorm klopt.","<span class=""mediumStar rating45""></span>",http://nlcdn.ar-cdn.com/recipes/xlarge/d68b3e72-4c65-420a-9690-21794905e521.jpg,(73),Witter dan Wit brood,475 ml melk|1 eetlepel basterdsuiker|2 theelepels zout|1 eetlepel boter|1 zakje (7 gr) bakkersgist|4 eetlepels warm water (45°C)|825 gr bloem,3,"3,35"
"Doe de broodmix in een kom (je kunt ook zelf brood maken sla stap 1,2,3,4 over)|Voeg het water toe.|Kneed het door elkaar.|Laat het deeg 3 kwartier rijzen in de bak met een natte theedoek of vershoudfolie eroverheen.|Laat de oven voorverwarmen op zo'n 220 graden C.|Pers de knoflook fijn en doe het in een bakje.|Voeg nu de kruidenboter toe en prak het door elkaar.|Voeg de rozemarijn toe.|Als het brood klaar is met rijzen rol je het uit.|Smeer het mengsel van de knoflook, kruidenboter en de rozemarijn uit over het deeg.|Rol het deeg op en vouw de uiteinden naar binnen. Je kunt eventueel nog wat olijfolie over het brood smeren.|Leg het brood nu op een bakplaat of in een ovenschaal in de oven.|Bak het brood 25 tot 30 min in de voorverwarmde oven.|En smullen maar!","<span class=""mediumStar rating0""></span>",http://nlcdn.ar-cdn.com/recipes/xlarge/a9f2989a-4480-41a1-8bf7-2564536d31b9.jpg,(0),Kruidenbrood,2/3e pakje kruidenboter (kan je ook zelf maken)|3 teentjes knoflook|2 theelepels rozemarijn|500 gram broodmix|300 ml water (of zoveel als op de verpakking staat aangegeven),2,"1,32"
"Suiker, gist en warm water in een grote kom vermengen en gist laten activeren.
|Iets meer dan de 1/2 van de bloem door het gistmengsel roeren en tot een glad deeg kneden.
|Afdekken en 15 minuten laten staan.
|Zout erdoor kneden en voldoende van de resterende bloem om een stevig deeg te maken. Kneed dit zacht en glad. Een kom met olie invetten, het deeg erdoor wentelen en tot verdubbeld volume laten rijzen (ik zet de kom in de oven met het lampje aan, de perfecte temperatuur om deeg te laten rijzen).
|Als het deegvolume is verdubbeld het deeg neerslaan en tot 3 dikke broden vormen. Zware bakplaten invetten en met griesmeel bestrooien. De broden op de bakplaten leggen, met een theedoek afdekken en laten rijzen.
|Eenmaal gerezen met een verstuiver water over de broden spuiten en in de voorverwarmde oven (230°C/gasstand 8) schuiven. Tijdens het bakken een paar keer met water bespuiten en omdraaien. De broden zijn gaar als ze goudbruin zijn en hol klinken als je tegen de onderkant klopt.
","<span class=""mediumStar rating45""></span>",http://nlcdn.ar-cdn.com/recipes/xlarge/245fddca-51d5-4dc1-8e5f-704e9ab72f4d.jpg,(594),Mama's Italiaanse brood,750 ml warm water (45°C)|1 theelepel kristalsuiker|1 eetlepel droog bakkersgist|800 gr bloem|1 eetlepel zout,20,"1,20"
"De oven voorverwarmen op 200°C/gasstand 6 en een bakplaat licht invetten.
|Bloem, suiker, bakpoeder en zout in een grote kom zeven. De sojaspread erdoor wrijven tot een kruimeldeeg ontstaat (ik doe het met mijn handen).
|Maanzaad, citroenrasp en citroensap erdoor roeren. Sojamelk en water vermengen en geleidelijk door de droge ingrediënten roeren tot het vochtig deeg ontstaat. Het is niet altijd nodig alle vloeistof te gebruiken.
|Grote scheppen deeg met een tussenruimte van 6 cm over de ingevette bakplaat verdelen.
|10-15 minuten in de voorverwarmde oven bakken tot de scones goudkleurig zijn.
","<span class=""mediumStar rating45""></span>",http://nlcdn.ar-cdn.com/recipes/xlarge/bdb32215-83b0-4a4f-8076-21a5672e8a41.jpg,(10),Citroenscones met maanzaad,"250 gr bloem|150 gr basterdsuiker|1 el bakpoeder|1/2 tl zout|165 gr melkvrije sojaspread|1 citroen, schil geraspt en geperst|1 el maanzaadjes|120 ml sojamelk|120 ml water",10,25
"Vermeng in een middelgrote kom de bloem, cayennepeper en een snufje zout. Werk er met een deegsnijder of twee messen de boter en margarine door, zodat u een kruimelig mengsel krijgt. Meng er geleidelijk 1½ dl water door, zodat u een glad deeg krijgt. Kneed dit 5 minuten, tot het glad en elastisch is. Doe het over in een kom die u licht ingevet hebt met de olie. Laat het afgedekt 1 uur rusten.|Verwarm de oven voor op 210 °C. Houd 2 bakplaten met antiaanbaklaag bij de hand. Verdeel het deeg in 4 stukken. Rol elk stuk uit tot een ronde lap van 23 cm doorsnee en circa 1½ mm dik. Leg ze op de bakplaten. Bestrijk ze met het eiwitmengsel en bestrooi ze met de zonnebloem- en pompoenpitten. Bestrooi elk brood met 2 theelepels Parmezaanse kaas. Bak de platte broden 12 minuten, of tot ze goudbruin, knapperig en licht uitgerezen zijn.","<span class=""mediumStar rating0""></span>",http://nlcdn.ar-cdn.com/recipes/xlarge/f90f56a0-1650-42ed-b4c1-43a35aea7128.jpg,(0),Knapperig plat brood met pitten,"250 g bloem|¼ theel. cayennepeper|zout|15 g boter|3 theel. margarine|1 theel. plantaardige olie|1 eiwit, licht schuimig geklopt met 2 theel. water|3 eetl. gedopte pompoenpitten|3 eetl. gedopte zonnebloempitten, geroosterd|2 eetl. geraspte Parmezaanse kaas","1,10","1,25"
De ingrediënten volgens de instructies van de fabrikant aan de broodmachine toevoegen. Selecteer het menu en druk op Start. Als het menu 5 minuten op gang is de structuur van het deeg controleren. Eventueel meer rijstmeel of vocht toevoegen.|Als het brood gaar is 10-15 minuten laten afkoelen alvorens het uit de bakvorm te verwijderen.,"<span class=""mediumStar rating45""></span>",http://nlcdn.ar-cdn.com/recipes/xlarge/9f7210a2-b542-42e6-900f-dac4ccf5e7de.jpg,(107),Glutenvrij brood,"1 ei|80 ml eiwit|1 eetlepel appelazijn|60 ml koolzaadolie|60 ml honing|350 ml magere melk, verwarmd|1 theelepel zout|1 eetlepel xanthaangom|70 gr tapiocameel|4 eetlepels kikkererwtenmeel|4 eetlepels gierst|160 gr|160 gr volkoren rijstmeel|1 eetlepel droog gist",10,"1,10"
"Meel, suiker, zout, melkpoeder, water, boter en gist volgens de aanwijzingen van de fabrikant aan de broodmachine toevoegen. Selecteer het deegmenu en druk op Start.|Het gerezen deeg uit de machine halen, neerslaan en op een bebloemde ondergrond leggen. Het deeg in 10 gelijke delen verdelen en tot bolletjes vormen. De bolletjes over licht ingevette bakplaten verdelen. Afdekken met een vochtige doek en in ong. 40 minuten tot verdubbeld volume laten rijzen. Intussen de oven voorverwarmen op 180°C/gasstand 4.|In een kleine kom eiwit en 2 eetlepels water mengen en de bolletjes met een dun laagje besmeren. 15 minuten in de voorverwarmde oven bakken tot de bolletjes goudbruin zijn.","<span class=""mediumStar rating45""></span>",http://nlcdn.ar-cdn.com/recipes/xlarge/e12d413a-f779-45c1-b6d1-b44ba0e91d03.jpg,(713),Bolletjes uit de broodmachine,"400 gr tarwemeel|3 eetlepels suiker|1 theelepel zout|2 eetlepels droge melkpoeder|225 ml warm water (45°C)|2 eetlepels boter, op kamertemperatuur|7 gr droge gist|het wit van 1 ei|2 eetlepels water","1,20","1,35"
"De oven voorverwarmen op 180°C/gasstand 4. In een middelgrote kom bloem, bakpoeder en zout mengen.|In een aparte kom suiker, roomkaas en ei tot een luchtige massa kloppen. Banaan en Chaithee erdoor roeren. Het bloemmengsel toevoegen en tot een glad beslag mengen.|Giet het beslag in een ingevette bakvorm van 23x12 cm.|60 minuten in de voorverwarmde oven bakken. Op een metalen rooster laten afkoelen (het brood na 10 minuten uit het bakblik halen om volledig af te koelen).","<span class=""mediumStar rating45""></span>",http://nlcdn.ar-cdn.com/recipes/xlarge/8a28a6c0-ef15-40a4-84b9-03bb04572393.jpg,(113),Bananenbrood met chai,"225 gr bloem|1 eetlepel bakpoeder|1/2 theelepel zout|150 gr suiker|110 gr vetarme roomkaas|2 eieren|170 gr banaan, gepureerd|4 eetlepels bereide Chaithee, op kamertemperatuur",10,"1,10"
"Voor de starter: Doe 1/3 van de meel en 60 ml water in een kom of bak en roer goed. Dek af en laat het 1 nacht op kamertemperatuur staan. Voeg de volgende dag weer 1/3 van de meel en 60 ml water toe. Dek weer af en laat het nogmaals 1 nacht op kamertemperatuur staan. Voeg op de derde dag het resterende 1/3 deel van de meel en 60 ml water toe, dek af en laat weerom 1 nacht op kamertemperatuur staan.|Voor het deeg: Los in een grote kom de gist en suiker op in het warme water. Laat het staan totdat het er romig uitziet, ongeveer 10 minuten.|Verdeel de starter in kleine stukjes en voeg deze toe aan het gistmengsel. Voeg 550 gr meel en het zout toe en roer goed door. Voeg vervolgens onder voortdurend roeren steeds 70 gr meel toe, totdat het meel op is. Als het deeg mooi is, leg het dan op een licht met bloem bestoven werkblad en kneed het in zo'n 8 minuten tot een glad en elastisch deeg. Strooi een beetje bloem over het deeg, dek het af met een droge doek en laat het rijzen totdat het in volume verdubbeld is.|Leg het deeg op een licht met bloem bestoven werkblad en druk alle lucht eruit. Verdeel het in twee gelijke stukken en kneed beide stukken zo'n 2-3 minuten. Vorm van ieder stuk een ovaal brood. Bestrooi twee bakplaten met wat polenta en rol de broden uit tot een ovaal van ongeveer 40x30 cm. Bestuif de bovenkant van de broden met wat bloem. Dek af met een droge doek en laat ze op een warme plaats rijzen totdat ze in volume verdubbeld zijn. Verwarm ondertussen de oven voor op 220 graden Celsius/Gasovenstand 7.|Bak de broden 30 - 40 minuten in een voorverwarmde oven. Spray er gedurende de eerste 15 minuten iedere 5 minuten wat water overheen. De broden zijn klaar wanneer de bodem hol klinkt als je er op klopt. Laat ze afkoelen op een rooster voordat je ze serveert.","<span class=""mediumStar rating45""></span>",http://nlcdn.ar-cdn.com/recipes/xlarge/3fa35167-22dc-47f2-9785-a98520e8aeb6.jpg,(19),Ekmek (Turks brood),"200 gr meel|180 ml water|5 tl gedroogde gist|1 tl basterdsuiker|500 lauwwarm water (45 graden Celsius)|820 gr meel|2 tl zout|4 - 8 el polenta (maïsmeel), indien nodig",1,"1,40"
"Laat het zuurdesemzetsel op kamertemperatuur komen.|De ingrediënten toevoegen aan de broodbakmachine volgens de instructies van de fabrikant.|Kies het basismenu of het menu voor wit brood, zet het korstmenu op medium en druk op Start.","<span class=""mediumStar rating45""></span>",http://nlcdn.ar-cdn.com/recipes/xlarge/0ea23354-1b15-4a2e-b2b8-a936721ada6b.jpg,(88),Zuurdesem brood,280g (10 oz) zuurdesem zetsel|5 eetlepels water|385 gr bloem|1 eetlepel suiker|1 eetlepel plantaardige olie|1 theelepel zout|2 theelepels droge gist,10,"2,10"
"Doe het warme water, suiker, honing, plantaardige olie, zout, 2 eieren, meel en gist in de bak van de broodbakmachine in de volgorde die door de handleiding wordt geadviseerd. Selecteer de deeg-stand en zet de machine aan.|Als de machine klaar is, haal dan het deeg eruit en leg het op een licht met bloem bestoven werkblad. Druk het deeg plat en laat het 5 minuten rusten.|Verdeel het deeg in 2 gelijke stukken. Verdeel een helft in 3 gelijke stukken, rol ieder stukje uit tot een lang dun rolletje met een lengte van 30-35 centimeter en vlecht alle 3 de stukken vervolgens tot een brood. Doe hetzelfde met de andere helft. Leg beide broden op een ingevet bakblik, spray er wat water over, dek af met wat doorzichtig keukenfolie en laat het 1-1,5 uur in een warme, tochtvrije plaats rijzen tot het in volume verdubbeld is.|Verwarm de oven voor op 180 graden Celsius/Gasovenstand 4. Klop 1 ei en 1 el water door elkaar in een klein kommetje.|Smeer de gerezen broden in met het eimengsel en bak de broden af in een voorverwarmde oven gedurende 20-25 minuten. Als het brood te snel bruin begint te worden, dek het dan af met wat aluminiumfolie.","<span class=""mediumStar rating45""></span>",http://nlcdn.ar-cdn.com/recipes/xlarge/761cd443-eef4-4b7f-82a5-589c7ce1c2ff.jpg,(198),Gevlochten challe (Joods brood) uit de broodbakmachine,"250 ml warm water|100 gr basterdsuiker|1 el honing|125 ml plantaardige olie|1,5 tl zout|2 eieren, op kamertemperatuur|550 gr bloem|2 1/4 tl snelgist|1 geklopt ei|1 el water",30,55
"Meng in een grote kom het warme water, de gist en 5 eetlepels honing. Roer er dan de bloem door. Laat het 30 minuten staan, of tot zich belletjes beginnen te vormen.|Meng 50 g gesmolten boter, het zout en de rest van de honing erdoor. Roer de helft van het volkorenmeel erdoor.|Bestuif een werkoppervlak met bloem en kneed het deeg met de rest van het volkorenmeel tot het nog maar nauwelijks aan de handen kleeft - je kunt het van het aanrecht afnemen, maar het is nog plakkerig. Misschien moet er wat extra volkorenmeel bij. Leg het deeg in een met olie bestreken kom en draai het een keer om zodat het deeg helemaal met olie bedekt is. Leg een theedoek op de kom en laat het op een warme plaats rijzen, tot het in volume verdubbeld is.|Druk het deeg plat met een vuist, kneed het licht en vorm er 3 broden van. Leg die in ingevette broodvormen van ca. 10x25 cm. Laat het deeg rijzen tot het 2 of 3 cm boven de rand van de broodvorm uitkomt.|Bak de broden 25 tot 30 minuten op 180 C. Strijk met een kwastje de resterende boter uit over de bovenkant van de broden om te voorkomen dat de korst hard wordt. Laat de broden helemaal afkoelen op een rooster.","<span class=""mediumStar rating45""></span>",http://nlcdn.ar-cdn.com/recipes/xlarge/ba5104f3-ebb1-4e39-a8e8-444c0ae09d0c.jpg,(2064),Eenvoudig volkorenbrood,"750 ml warm water (45 C)|15 g (2 zakjes) droge gist|5 eetepels (75 ml) honing|675 g bloem|50 g boter, gesmolten|5 eetepels (75 ml) honing|1 afgestreken eetlepel (15 g) zout|425 g volkorenmeel|30 g boter, gesmolten",45,"1,15"
