Step by step,Rating,Image Link,Count Rating,Title,Ingredients,Preparation Time,Finish Time
"Doe de aardappelen in een pan met kokend water en laat 15 minuten koken of tot ze zacht zijn. Laat ze uitlekken, maar bewaar het kookvocht. Verwijder de schil van de aardappelen als ze een beetje zijn afgekoeld. Stamp of prak ze fijn en laat ze afkoelen.|Zeef 600 g van de bloem samen met het zout boven een grote kom. Voeg de fijngemaakte aardappelen toe en wrijf ze met uw vingertoppen door de bloem tot alles goed is gemengd. Voeg de gist toe aan het mengsel en roer goed.|Neem 300 ml van de kookvloeistof van de aardappelen en warm het iets op, tot het lauw is. Voeg de melassestroop eraan toe en roer tot die is opgelost. Giet dit mengsel bij het bloemmengsel en meng goed. Dit kunt u het beste met uw handen doen. Voeg dan langzaam zoveel van de resterende bloem toe als nodig is om een zacht, maar niet kleverig deeg te krijgen.|Leg het deeg op een bebloemd werkblad en kneed 5-10 minuten, tot het smeuïg en elastisch is. Leg het deeg dan in een grote, ingevette kom en dek af met een iets vochtige theedoek. Laat circa 40 minuten op een warme plek rijzen, of tot het volume met de helft is toegenomen.|Leg het deeg opnieuw op een bebloemd werkblad en klop het plat. Kneed het gedurende circa 3 minuten. Verdeel het deeg in tweeën en vorm elke portie tot een brood. Leg de 2 broden in 2 goed ingevette broodvormen van 0,5 l inhoud. Dek ze opnieuw af met de theedoek en laat ze nog 20 minuten rijzen op een warme plek.|Verwarm de oven tegen het einde van het rijzen voor op 180 °C. Verwijder de theedoek en bak de broden 40-45 minuten, of tot ze goed zijn gerezen, bruin zijn en hol klinken wanneer u ze uit de vormen haalt en op de onderkant klopt. Leg ze op een rooster om af te koelen. U kunt dit brood tot een week bewaren.","<span class=""mediumStar rating5""></span>",http://nlcdn.ar-cdn.com/recipes/xlarge/7334cd93-732b-4dde-ad18-5a1ae6428650.jpg,(1),Aardappelbrood,"400 g bloemige aardappelen, geschrobd en in grote stukken gesneden|700 g witte bloem|1 tl zout|1 zakje instantgist, circa 7 g|1 el melassestroop","1,45","2,30"
"Doe het water in een klein kommetje en los hierin de gist op. Laat de oplossing in 10 minuten romig worden.|Verwarm in een klein pannetje de melk tot bijna tegen het kookpunt (er moeten belletjes op komen). Haal het pannetje van het vuur en voeg de boter toe. Roer de boter door de melk totdat het helemaal gesmolten is en laat het vervolgens lauw worden.|Vermeng in een grote kom gistmengsel, gekoelde melk, boter, ei, 250 gr bloem en zout en roer goed door elkaar. Voeg beetje bij beetje de resterende bloem toe (zorg ervoor dat alle bloem goed door het mengsel is opgenomen alvorens nieuwe bloem toe te voegen). Als een stevig deeg is ontstaan, leg het dan op een licht met bloem bestoven ondergrond en kneed totdat het glad en soepel is, ongeveer 8 minuten. Dek het deeg af en laat 10 minuten rusten.|Verdeel het deeg in 7 stukken: een rondje met een diameter van 5 centimeter, 5 rondjes met een diameter van 2,5 centimeter en vorm van de rest van het deeg een grote cirkel.|Leg de grote cirkel op een licht ingevette bakplaat en druk zachtjes aan. Maak met 4 van de 5 rondjes (met de diameter van 2,5 centimeter) de pootjes van de schildpad en vorm van het vijfde rondje een staart. Vorm het rondje (met de diameter van 5 centimeter) tot een hoofd. Bevestig ieder stukje aan het lijf door het uiteinde (het gedeelte dat tegen het lijf zit) plat te drukken, een beetje nat te maken met wat water en het vervolgens onder het lijf te schuiven. Maak twee oogjes van de rozijntjes.|Bedek de schildpad met een schone, vochtige doek en laat het 20 minuten rijzen. Verwarm ondertussen de oven voor op 200°C/gasstand 6.|Maak met een scherp mes kruislingse strepen over de rug van de schildpad, zodat het op een echt schild lijkt. Gebruik een schaar om de mond van de schildpad te maken en bak hem 20-25 minuten af op 200°C tot hij mooi bruin is.","<span class=""mediumStar rating45""></span>",http://nlcdn.ar-cdn.com/recipes/xlarge/0f77d95a-8f60-40f7-b817-91ef77054e5b.jpg,(58),Schildpadbrood,2 tl gedroogde gist|1 el basterdsuiker|120 ml warm water (45°C)|120 ml melk|1 el boter|1 ei|375 gr bloem|1 tl zout|2 sultana's of rozijntjes ter decoratie,40,"1,10"
"Doe dit een of twee dagen van tevoren. Doe de blanke amandelen in een blender of keukenmachine en maal fijn tot het aanvoelt als nat zand. Doe het amandelmeel in een grote kom en roer het eigeel, de gezeefde poedersuiker, citroenrasp en het amandelextract erdoor. Is het mengsel te droog? Voeg dan ook wat van het eiwit toe. Goed roeren tot een romig mengsel. Deze stap kun je overslaan als je spijs uit een pakje gebruikt.|Wel de vruchten ongeveer 30 minuten in lauwwarm water en laat daarna 30 minuten uitlekken. Dep nog extra droog met keukenpapier.|Weeg de ingrediënten voor het deeg af. Doe alle ingrediënten behalve de boter in het bakblik van de broodbakmachine volgens de instructies van de fabrikant. Zet de machine op de kneedstand en voeg na 10 minuten de boter in blokjes toe aan het deeg. Voeg eventueel een beetje bloem toe als het deeg te nat is. Kneed het deeg in nog ongeveer 10 minuten tot een stevige deegbal. Het deeg hoort nog wat plakkerig te zijn (Levine vergelijkt het met de plakrand van een Post-it blaadje).|Laat het deeg na het kneden 15 minuten rusten met een lichtjes met bloem bestoven theedoek.|Het toevoegen van de vruchten aan het deeg gaat voorzichtig, omdat je niet wilt dat de vruchten breken. Als vruchten kapot gaan, rijst het deeg straks minder goed. Voeg de vruchten daarom niet toe terwijl het deeg in de broodbakmachine zit. Ga als volgt te werk: dep de gewelde vruchten goed droog met keukenrol en bestuif een werkvlak met bloem. Rol het deeg uit tot een rechthoekige lap met een deegroller.|Verdeel de helft van de vruchten over het deeg.|Vouw de boven- en onderkant van het deeg naar binnen. Laat het deeg hierbij overlappen.|Ga er met de deegroller overheen tot je het deeg een platte lap is geworden. Door op deze manier te werk te gaan, blijven de vruchten in het deeg heel.|Doe nu weer hetzelfde, verdeel de rest van de vruchten over het deeg, vouw het deeg dicht en rol met de deegroller plat. Druk naden dicht.|Vorm het deeg voorzichtig op tot een bal (niet kneden, want dat gaan de vruchten kapot). Vet een grote kom in met wat zonnebloemolie en rol de deegbal langs de randen van de kom om de bal met een dun laagje olie te bedekken. Dek de kom af met een theedoek en laat het deeg ongeveer 1 uur op een warme plek in het huis rijzen. Het deeg zal niet helemaal in volume verdubbelen.|Rol 250 gr amandelspijs op tot één rol. Op de foto zijn 3 rollen amandelspijs te zien, omdat ik 3 broden tegelijk heb gemaakt.|TIP: Het is mijn voorkeur om veel amandelspijs in de stol te verwerken, maar de 300 gr die ik heb toegevoegd was iets te veel. 200 tot 250 gr spijs is een betere hoeveelheid, omdat met 300 gr wat van de spijs uit het brood liep tijdens het bakken.|Stort het deeg uit op een licht met bloem ingevette werkplek. Rol het deeg met een deegroller uit tot een ovaal van ongeveer 2 cm dik. Laat de boven- en onderkant van het deeg iets dikker. Leg de rol amandelspijs in het midden van het deeg. |TIP: Het is belangrijk de spijs niet te dicht bij de randen te leggen en ook om de naden erg goed dicht te knijpen. Dan zal de amandelspijs beter in het brood blijven zitten en niet tijdens het bakken eruit lopen. Op de foto hiernaast heb ik iets te veel spijs gebruikt, dat iets te dicht bij de rand ligt.|Vouw het deeg dubbel en maak alle goed naden dicht.|Dek het deeg af met plasticfolie en laat 45 minuten rijzen. Verwarm ondertussen de oven voor op 180°C.|Bak de stol in de voorverwarmde oven in ongeveer 35 minuten gaar en bruin. Als de stol te donker wordt, dek deze dan af met een vel aluminiumfolie.|Haal de gaar gebakken stol uit de oven en laat afkoelen op een rooster. Smeer de bovenkant van de stol in met gesmolten roomboter en bestrooi met poedersuiker. Laat de stol volledig afkoelen. Je kunt de stol als deze is afgekoeld ook invriezen (in dit geval niet met poedersuiker bestrooien, maar alleen met boter insmeren). Bestrooi de stol voor het serveren wederom met poedersuiker. De stol blijft ongeveer een week vers.","<span class=""mediumStar rating5""></span>",http://nlcdn.ar-cdn.com/recipes/xlarge/d929b0c5-afaa-4395-8264-57f375a1a80e.jpg,(1),Stol met spijs,"375 gr bloem (liefst met hoog proteïnegehalte, 12% of voeg een eetlepel gluten toe aan de bloem)|10 gr instant gist|50 gr suiker|160 gr volle melk, lauwwarm|1 ei|1/2 theelepel speculaaskruiden|7 gr zout|75 gr roomboter, op kamertemperatuur|50 gr gedroogde abrikozen, in stukjes|100 gr blauwe rozijnen|100 gr blanke rozijnen|50 gr gedroogde kersen, in stukjes|30 gr gedroogde cranberry's, in stukjes|150 gr blanke amandelen, heel|150 gr poedersuiker, gezeefd|1 ei (alleen het eigeel)|1 eetlepel amandelextract|5 gr citroenrasp|25 gr gesmolten roomboter|poedersuiker",30,"1,3"
"Verwarm de oven voor op 175 graden C. Vet twee cakevormen van ongeveer 23x13 cm in. Meng de bloem, baksoda en zout in een kom.|Klop in een aparte grote kom de boter, roomboter, witte suiker en basterdsuiker met een elektrische mixer op de laagste stand tot alles goed gemengd is, voeg de bananen, eieren, karnemelk, zure room en vanille-extract toe tot alles goed gemengd is. Meng de helft van het bloemmengsel met het bananenmengsel; klop tot het goed gemengd is; voeg vervolgens het resterende bananenmengsel toe. Mix op medium snelheid gedurende 1 minuut. Giet het beslag in de ingevette cakevormen.|Bak in de voorverwarmde oven totdat een tandenstoker die je in het midden van de cake prikt er schoon uitkomt, 50 minuten tot 1 uur. Laat 15 minuten afkoelen, serveer warm.","<span class=""mediumStar rating45""></span>",http://nlcdn.ar-cdn.com/recipes/xlarge/216774.jpg,(33),Angie's bananenbrood,350 gram bloem|2 theelepels baksoda|1 theelepel zout|115 gram boter op kamertemperatuur|115 gram roomboter|400 gram witte suiker|100 gram basterdsuiker|4 rijpe bananen|4 eieren|240 ml karnemelk|120 ml zure room|2.5 theelepels vanille-extract,50,50
"In een grote kom combineer je de broodblokjes met de helft van de chocolade stukjes.|In een pan meng je vervolgens de crème fraîche, room en cacao met een garde op laag vuur. Voeg de resterende chocolade stukjes toe en blijf roeren totdat de chocolade smelt.|Klop de eieren met de suiker in een middelgrote kom, voeg geleidelijk de room en het chocolade mengsel toe. Giet het mengsel over het brood en zet 1 uur opzij, zodat het brood een groot deel van het mengsel absorbeert.|Verwarm de oven voor op 190 C / gasoven stand 5.|Giet de pudding in 6 individuele vormpjes of een beboterde vierkante ovenschaal en bak in de oven gedurende 40 minuten.","<span class=""mediumStar rating45""></span>",http://nlcdn.ar-cdn.com/recipes/xlarge/d17d54c0-1c05-4ff1-8f29-7c5fc34a00b5.jpg,(2),Chocolade broodpudding,"300 gr wit brood met korsten, in kleine blokjes gesneden|250 gr chocolade stukjes|250 ml crème fraîche|250 ml room (probeer room met een zo hoog mogelijk vetgehalte te vinden, bij voorkeur 40%)|5 eetlepels ongezoete cacao|100 gr basterdsuiker|5 eieren",30,"1,10"
"Verwarm de oven voor op 200°C.|Bedek een bakplaat met bakpapier. Bestuif met bloem. Leg een van de deegcirkels op de bakplaat.|Verspreid de ricotto voorzichtig over de cirkel in een gelijkmatige laag.|Verspreid hierover de pesto in een gelijkmatige laag.|Leg de tweede deegcirkel er bovenop. Zet een glas in het midden van de cirkel.|Snij het deeg van het glas naar de rand in 16 punten van gelijke grootte. Dit kun je het gemakkelijkst doen door het deeg eerst in kwarten te snijden, dan elk kwart door de helft en dan elk van de 8 puntjes weer door de helft.|Werk steeds met twee punten en draai ze beiden twee keer in tegengestelde richting|Druk de uiteinden samen en herhaal dit dan met alle punten, tot je een stervorm hebt.|Bak 25-30 minuten in de voorverwarmde oven, tot het bladerdeeg mooi bruin is.","<span class=""mediumStar rating45""></span>",http://nlcdn.ar-cdn.com/recipes/originalxl/dfcd119a-65a4-474e-8610-cd272126e2c6.jpg,(12),Sterbrood met pesto,"2 grote vellen bladerdeeg, in cirkels van 30 cm doorsnee gesneden|bloem, om te bestuiven|240 gr ricotta kaas|240 gr verse pesto",25,50
"Week de krenten in warm water en zet opzij.|Meng het gist met de melk en suiker. Meng er geleidelijk de bloem door. Bedek het deeg en laat 20 minuten rijzen.|Giet ondertussen de krenten af en dep ze droog op een keuken handdoek.|Kneed de hele eieren, het zout, de kaneel en de boter door de bloem en maak een soepel deeg. Voeg de krenten aan het einde toe.|Breng het deeg over naar een ingevette ronde taartvorm en dek af. Laat 60 tot 90 minuten rijzen.|Verwarm de oven voor op 200 C / gasoven stand 6. Maak met behulp van een zeer scherp mes, een gleuf in een x-vorm in het brood en smeer er een losgeklopte eierdooier over. Bak gedurende 1 uur totdat de bovenkant goudbruin is. Haal uit de taartvorm en laat op een rooster afkoelen.","<span class=""mediumStar rating5""></span>",http://nlcdn.ar-cdn.com/recipes/xlarge/a1534460-173b-4b2b-969f-49802974cb7b.jpg,(2),Krentenbrood met kaneel,"375 gr krenten|50 gr verse gist|300 ml warme melk|1 kg witte bloem|150 gr basterdsuiker|2 eieren|200 gr boter, op kamertemperatuur|1 theelepel zout|1 theelepel kaneelpoeder|1 eierdooier, losgeklopt",30,"3,30"
"Meng alle droge ingrediënten in een kom en zorg dat de gist en het zout goed door de bloem worden verspreid. Voeg het lauwwarme water toe en meng met de hand tot het goed gemengd is.|Bedek de kom met plasticfolie en laat tenminste 12 uur maar niet langer dan 24 uur rusten (de tijd is afhankelijk van de omgevingstemperatuur, ongeveer 21°C is ideaal).|Leg het deeg op een met bloem bestoven werkvlak. Maak een platte langwerpige vorm en vouw de zijkanten over elkaar naar binnen. Dek losjes af met plasticfolie en laat 15 minuten rusten.|Vorm het deeg voorzichtig tot een bal. Dek af met een doek en laat 2 uur rijzen.|Zet een vuurvaste gietijzeren pan met een zware deksel in de oven om voor te verwarmen. Verwarm de oven voor op 230°C / gasovenstand 8 en doe dit met de pan in de oven.|Haal de hete pan uit de oven en leg het deeg voorzichtig in de hete gietijzeren pan en dek af met het deksel. Bak 45 minuten en verwijder het deksel tijdens de laatste 15 minuten.","<span class=""mediumStar rating45""></span>",http://nlcdn.ar-cdn.com/recipes/originalxl/abf7f5cb-482c-4c8b-95bf-fd6e3d9fbb6a.jpg,(47),Brood zonder kneden,420 gr tarwebloem|1 1/4 theelepel zout|1/4 theelepel droge gist|350 ml lauwwarm water,15,15
"In een brede kom of diep bord de eieren met suiker, kaneel en citroensap opkloppen. Melk erdoor kloppen.
|Strooi de noten op een plat bord.
|Halveer de sneetjes brood over de diagnonaal en haal ze 1 voor 1 door het beslag. Laat de sneetjes eventueel even in het beslag weken als dat nodig is (afhankelijk van hoe droog het brood is). Geef de sneetjes vervolgens 1 voor 1 een laagje pecannoot.
|In een grote koekenpan de 1/2 van de boter verhitten tot deze verkleurt en hierin ong. 1 minuut per kant de helft van het brood goudbruin bakken. Bak de rest van het brood in de resterende boter. Poedersuiker erover strooien en direct serveren.
","<span class=""mediumStar rating5""></span>",http://nlcdn.ar-cdn.com/recipes/xlarge/b4a92d32-793c-4f5a-96df-292f93ad67e3.jpg,(1),Wentelteefjes met pecannoot,"2 scharreleieren|1 eetl suiker|1 theel gemalen kaneel|1 theel vanillesuiker|1 theel geraspte citroenschil|2,5 dl melk|4 eetl pecannoot, gehakt|8 sneetjes oud, dikgesneden casinobrood|50g boter|poedersuiker",5,20
"Los de gist op in het hete water samen met de honing, en laat 10 minuten staan. Het hoort te gaan schuimen.|Roer 2 eieren en de zonnebloemolie samen met een houten pollepel. Voeg bloem, anijspoeder, kardemompoeder en zout toe, en kneed door elkaar. Voeg daarna de opgeloste gist in het water toe, en kneed tot een soepele bal. Te nat? Voeg meer bloem toe. Te droog? Meer water.|Smeer een grote kom in met een beetje zonnebloemolie, rol de deegbal langs de randen van de kom, zodat het met een klein laagje olie wordt bedekt. Leg de deegbal in de kom en dek de kom af met plasticfolie. Laat de deegbal minstens 1 uur in de kom rijzen.|Sla met een vuist de lucht uit het deeg. Je kunt ervoor kiezen het deeg opnieuw (45 minuten) te laten rijzen, maar om tijd te besparen kun je dit achterwege laten.|Verdeel het deeg na het rijzen in drieën, en rol er 3 slierten van. Vlecht de 3 slierten samen en laat 30 minuten onder een met bloem bestoven theedoek rijzen.|Verwarm ondertussen de oven voor op 175°C.|Klop 1 ei los, en besmeer het brood met het losgeklopte ei. Je kunt nu nog wat zeezout of suiker over de bovenkant strooien (optioneel).|Bak het brood 20-30 minuten in de oven. Dit brood was na 25 minuten klaar, maar houd het na 20 minuten in de gaten. Als je erop klopt, moet het hol klinken.|Haal het brood uit de oven, en laat op een rooster afkoelen.","<span class=""mediumStar rating5""></span>",http://nlcdn.ar-cdn.com/recipes/xlarge/eff3408d-b7a1-4fba-ab4d-708d246fb2a4.jpg,(1),Challah met anijs,"230 ml heet kraanwater|2,5 theelepel gedroogde gist|1,5 eetlepel honing|3 eieren|60 ml zonnebloemolie|500-600 gr bloem|1/2 - 1 theelepel anijspoeder|1/2 theelepel kardemompoeder|1 theelepel zout|1/2 theelepel zeezout (optioneel) of suiker",30,2
"Leg de theezakjes in een vuurvaste maatbeker en giet het kokend water erover. Roer even en laat dan 3-4 minuten trekken. Doe het gedroogde fruit in een kom. Haal de theezakjes uit de maatbeker en giet de thee over het fruit. Dek de kom af en laat ten minste 5 uur of een nacht weken.|Verwarm de oven voor op 160 °C. Vet een broodvorm van 900 ml in en bedek deze met bakpapier. Zeef de witte en de volkorenbloem, het bakpoeder en de kruiden boven een kom, en voeg ook zemelen uit de zeef en de suiker toe.|Voeg het geweekte gedroogde fruit toe, samen met de thee, en voeg ook het losgeklopte ei toe. Meng het ei en het fruit een beetje, en meng ze dan goed met het bloemmengsel. Het deeg moet zo vloeibaar zijn dat het van een lepel afdruipt. Voeg indien nodig nog 2-3 theelepels heet water toe.|Schep het deeg in de broodvorm en strijk het glad. Bak het brood circa 1¼ uur of tot het goed gerezen en stevig is. De korst moet mooi bruin zijn en mag iets barsten. Dek het brood tijdens de laatste 20 minuten van de baktijd losjes af met folie als het te bruin wordt.|Laat het brood in de broodvorm afkoelen gedurende circa 5 minuten, en leg het dan op een rooster om helemaal af te koelen. Dit brood smaakt vooral heel goed als het 1-2 dagen oud is. U kunt het in een plastic zak tot 5 dagen bewaren op een koele plaats.","<span class=""mediumStar rating4""></span>",http://nlcdn.ar-cdn.com/recipes/xlarge/2547825d-13a4-4de8-9392-eaa5d718f584.jpg,(1),Bara brith,"2 zakjes thee, bijvoorbeeld Ceylon|330 ml kokend water|225 g gemengd gedroogd fruit|175 g zelfrijzende witte bloem|175 g volkorenbloem (eventueel zelfrijzend)|1 tl bakpoeder|1 tl koekkruiden|50 g lichtbruine ruwe rietsuiker|1 ei, losgeklopt","5,10","6,25"
"In een grote kom tarwebloem, patentbloem, zout en suiker mengen. De klontjes boter erdoor roeren zodat alle klontjes een laagje meel hebben. Koud water en citroensap toevoegen. Houd de kom daarbij met lichte schudbewegingen in beweging zodat de ingrediënten gelijkmatig vochtig zijn. Het deeg in een bal kneden.|Op een licht bebloemd oppervlak het deeg tot een rechthoek van ong. 12 mm dikte uitrollen. Houd de hoeken zo haaks mogelijk. In dit stadium ziet het deeg er niet mooi uit, maar dat trekt bij. Vouw het deeg in drieën (zoals een zakelijke brief wordt gevouwen), in keukenfolie wikkelen en minstens 30 minuten in de koelkast leggen.|Het deeg op een bebloemd oppervlak in een richting leggen die haaks ligt op de richting waarin u hem net bereid heeft. Wederom tot een vierhoek uitrollen en in drieën vouwen. Als het deeg nog koud en handzaam is nogmaals in een haakse hoek draaien, uitrollen en in drieën vouwen. U kunt het deeg ook in de koelkast leggen en 30 minuten later verder verwerken. Rol het deeg uiteindelijk uit tot de maat van een bakplaat, op een licht bebloemde bakplaat leggen en in keukenfolie wikken. Minstens 30 minuten in de koelkast leggen alvorens te gebruiken.|Voor gebruik het deeg uitrollen tot een dikte van 6 mm en met een scherp mes in vorm snijden. Gebruik het zoals de recepten aangeven of vul het deeg met de gewenste vulling en bak ze vervolgens in een voorverwarmde oven op 200°C/gassstand 6 gezwollen en goudbruin.","<span class=""mediumStar rating45""></span>",http://nlcdn.ar-cdn.com/recipes/xlarge/a5aee915-6afc-4389-b49b-4fa6f03442f5.jpg,(24),Zelfgemaakt snel bladerdeeg,"200 gr tarwebloem|500 gr patentbloem|1 1/2 theelepel zout|4 eetlepels suiker|275 gr koude boter, in blokjes van elk 1 eetlepel|300 ml koud water|1 1/2 theelepel citroensap",2,2
"Doe alle ingrediënten (behalve ei en water) in de kom van de broodbakmachine, in de volgorde hierboven. Kies het programma voor deeg en zet de machine aan.|Als de machine klaar is, bestuif dan je handen en een ​​schoon werkoppervlak met bloem. Leg het deeg op het oppervlak en vorm er 8-10 ballen van. Dek af met een schone vochtige doek en laat 30 minuten op kamertemperatuur rijzen.|Pak vervolgens met bebloemde handen een bol deeg en druk in om lucht te verwijderen. Vouw het deeg over elkaar en dan horizontaal doormidden. druk de randjes dicht en vorm een ovaal bolletje van ongeveer 10 cm. Leg het broodje met de naad beneden op een bakplaat bekleed met bakpapier. Herhaal dit met het andere deeg. Dek af met een schone doek en laat 1 uur rijzen. De bolletjes zullen verdubbelen in volume.|Verwarm de oven voor op 180C. Klop het ei en een beetje water los in een kom. Bestrijk de broodjes hiermee en bak ze vervolgens 20 minuten in de voorverwarmde oven lichtbruin.","<span class=""mediumStar rating45""></span>",http://nlcdn.ar-cdn.com/recipes/xlarge/22ef0a19-bc91-44da-9242-fda5de635df9.jpg,(2),Franse witte broodjes,"50 gr zachte boter, in blokjes|1,5 theelepel zout|2 eetlepels witte basterdsuiker|250 ml melk|400 gr tarwebloem|1 theelepel droge bakkersgist|1 ei|scheutje water",30,50
Alle ingrediënten volgens de aanwijzingen van de fabrikant aan de broodmachine toevoegen. Selecteer het deegmenu.|Het deeg na het rijzen uit de bak halen en voor uw favoriete pizzarecept gebruiken.,"<span class=""mediumStar rating45""></span>",http://nlcdn.ar-cdn.com/recipes/xlarge/9108e884-92a2-4592-929d-0b9584a0f156.jpg,(151),Pizzabodem uit de Broodmachine,300 ml warm water (45°C)|250 gr witte bloem|175 gr griesmeel|1/2 theelepel ruwe basterdsuiker|1 theelepel zout|2 theelepels olijfolie|2 theelepels droog bakkersgist,2,2
"Doe de melk, boter, bruine suiker, ei, zout, kaneel, gist en broodmeel in de broodbakmachine in de volgorde die de fabrikant aanbeveelt. Selecteer het witbrood programma.|Voeg ongeveer 5 minuten voor het einde van het mengproces de gedroogde vruchten toe. Indien de broodbakmachine een fruit-stand heeft, gebruik die dan.","<span class=""mediumStar rating45""></span>",http://nlcdn.ar-cdn.com/recipes/xlarge/3ad6d97e-9358-4ac1-8277-8d7d9bac8571.jpg,(15),Kersen en rozijnenbrood,200 ml melk|3 eetlepels boter|1 eetlepel bruine basterdsuiker|1 ei|1 theelepel zout|1 eetlepel kaneelpoeder|400 gr tarwemeel|1/2 theelepel gist (voor de broodbakmachine)|75 gr gedroogde kersen|75 gr rozijnen,5,"2,35"
"Doe alle ingrediënten in de pan van de broodmachine in de door de gebruiksaanwijzing aanbevolen volgorde en zet op Start.
","<span class=""mediumStar rating45""></span>",http://nlcdn.ar-cdn.com/recipes/xlarge/d5e03114-af1b-48bd-85ae-557c6d66db57.jpg,(173),Zuurdesem uit de broodbakmachine,175ml warm water (45 C)|250g zuurdesem zetsel|1 1/2 theel zout|375g bloem|1 1/2 theel droge gistkorrels,5,"3,5"
"Verwarm de oven voor op 200 °C. Zeef de witte en de volkorenbloem, het zuiveringszout en het zout boven een kom, en voeg ook eventuele zemelen uit de zeef weer toe.|Maak in het midden een kuiltje en giet er de karnemelk in. Roer de bloem beetje bij beetje met een houten lepel door de karnemelk tot een zacht deeg ontstaat. Neem het deeg dan met uw handen bij elkaar en leg het op een lichtbebloemd werkblad. Kneed het lichtjes en niet al te lang tot een zachte bal ontstaat.|Leg het deeg op een ingevette bakplaat en klop het een beetje plat tot u een bol, rond brood met een diameter van circa 19 cm hebt. Maak met een scherp mes een diep kruis boven in het brood. Snijd tot in het midden van het brood. Strooi, voor u het brood in de oven zet, een beetje extra volkorenbloem over het brood.|Bak het brood circa 30 minuten tot het goed is gerezen en bruin is en het hol klinkt wanneer u op de onderkant klopt. (Als het vochtig en zwaar klinkt, bak het dan nog 3-5 minuten en test het daarna opnieuw.)|Leg het brood op een rooster en laat helemaal afkoelen. Serveer het brood op de dag van bereiding of rooster het de volgende dag.","<span class=""mediumStar rating5""></span>",http://nlcdn.ar-cdn.com/recipes/xlarge/b339c7c5-f2a4-469e-a1aa-4dc10c886024.jpg,(1),Iers brood,"250 g witte bloem|250 g volkorenbloem, plus een beetje om te bestrooien|1 tl zuiveringszout|½ tl zout|300 ml karnemelk",10,40
